ID,Year,Author,Title,Url,Abstract,Conference
1,2022,"Walter, Maximilian; Heinrich, Robert; Reussner, Ralf",Architectural Attack Propagation Analysis for Identifying Confidentiality Issues,https://www.computer.org/csdl/proceedings-article/icsa/2022/172800a001/1DDCrxWsrde,"Exchanging data between different systems enables us to build new smart services and digitise various areas of our daily life. This digitalisation leads to more efficient usage of resources, and an increased monetary value. However, the connection of different systems also increases the number of potential vulnerabilities. The vulnerabilities on their own might be harmless, but attackers could build attack paths based on the combination of different vulnerabilities. Additionally, attackers might exploit existing access control policies to further propagate through the system. For analysing this dependency between vulnerabilities and access control policies, we extended an architecture description language (ADL) to model access control policies and specify vulnerabilities. We developed an attack propagation analysis operating on the extended ADL, which can help to determine confidentiality violations in a system. We evaluated our approach by analysing the accuracy and the effort compared to a manual analysis using different scenarios in three case studies. The results indicate that our analysis is capable of identifying attack paths and reducing the effort compared to manual detection.",ICSA
2,2022,"Li, Ruiyin; Soliman, Mohamed; Liang, Peng; Avgeriou, Paris",Symptoms of Architecture Erosion in Code Reviews: A Study of Two OpenStack Projects,https://www.computer.org/csdl/proceedings-article/icsa/2022/172800a024/1DDCsCQXXe8,"The phenomenon of architecture erosion can negatively impact the maintenance and evolution of software systems, and manifest in a variety of symptoms during software development. While erosion is often considered rather late, its symptoms can act as early warnings to software developers, if detected in time. In addition to static source code analysis, code reviews can be a source of detecting erosion symptoms and subsequently taking action. In this study, we investigate the erosion symptoms discussed in code reviews, as well as their trends, and the actions taken by developers. Specifically, we conducted an empirical study with the two most active Open Source Software (OSS) projects in the OpenStack community (i.e., Nova and Neutron). We manually checked 21,274 code review comments retrieved by keyword search and random selection, and identified 502 code review comments (from 472 discussion threads) that discuss erosion. Our findings show that (1) the proportion of erosion symptoms is rather low, yet notable in code reviews and the most frequently identified erosion symptoms are architectural violation, duplicate functionality, and cyclic dependency; (2) the declining trend of the identified erosion symptoms in the two OSS projects indicates that the architecture tends to stabilize over time; and (3) most code reviews that identify erosion symptoms have a positive impact on removing erosion symptoms, but a few symptoms still remain and are ignored by developers. The results suggest that (1) code review provides a practical way to reduce erosion symptoms; and (2) analyzing the trend of erosion symptoms can help get an insight about the erosion status of software systems, and subsequently avoid the potential risk of architecture erosion.",ICSA
3,2022,"Hammad, Mahmoud M.; Abueisa, Ibrahim; Malek, Sam",Tool-Assisted Componentization of Java Applications,https://www.computer.org/csdl/proceedings-article/icsa/2022/172800a036/1DDCpYMfzG0,"Many popular object-oriented (OO) programming languages, such as Java, do not provide explicit support for architecture-based development, i.e., do not provide programming-language constructs that are at the granularity of architectural constructs, such as components and ports. The gap between how engineers design their systems and how they implement them has been one of the leading causes of architectural drift—a situation in which the prescriptive architecture (the designed architecture) does not match the descriptive architecture (the implemented architecture). To mitigate this challenge, in its ninth iteration, Java introduced the concept of Java Platform Module System (JPMS), which for the first time provides explicit implementation-level support for well-known architectural constructs, such as components (called modules) and ports (called module directives). Despite this, the majority of existing Java applications (apps) are still purely OO programs that do not make use of the new constructs, because converting them to well-structured component-based (CB) programs is a tedious and error-prone task. In fact, prior research has shown that when engineers convert OO apps to CB apps, they tend to be highly over-privileged, i.e., components are granted more access privileges than they actually need. To mitigate these challenges, we have developed OO2CB, an approach for conversion of an OO Java app to a least-privilege CB Java app. OO2CB employs component recovery techniques to assist the developer in determining a given OO app’s components. It then statically analyzes the source code of the app to determine the dependencies among its recovered components and the required port types for facilitating their interaction. Finally, OO2CB generates a functionally equivalent CB app that satisfies the least-privilege security principle. Our experiments on several large real-world OO Java apps corroborate the effectiveness of OO2CB.",ICSA
4,2022,"Muszynski, Michel; Lugtigheid, Sven; Castor, Fernando; Brinkkemper, Sjaak",A Study on the Software Architecture Documentation Practices and Maturity in Open-Source Software Development,https://www.computer.org/csdl/proceedings-article/icsa/2022/172800a047/1DDCsiTW4mY,"The best practices in the industry for Software Architecture (SA) documentation are not always followed, despite it being known that SA documentation can positively influence different aspects of software development. Open-Source Software (OSS) projects often operate in a different manner compared to proprietary software projects. This study investigates contemporary SA documentation practices in OSS projects to gain insights into: (1) what architectural elements are described, (2) what the different description formats and types are, and (3) what the maturity of the architecture description is. The SA description documentation of six OSS projects is identified, classified, and evaluated: VLC, OpenEHR, openKM, GIMP, Audacity, and Home Assistant. The results show that natural language is widely used in describing the architecture, sometimes accompanied by diagrams of informal models. The majority of documentation was found on websites and wikis. The maturity was evaluated by applying the Architectural Capability Model (ArchCaMo). Out of the five maturity levels, most projects did not get past the first level. Only one project reached the second level, and one project showed potential for level three as it was the only project with explicitly documented SA design decisions.",ICSA
5,2022,"Dieu, Musengamana Jean de; Liang, Peng; Shahin, Mojtaba",How Do Developers Search for Architectural Information? An Industrial Survey,https://www.computer.org/csdl/proceedings-article/icsa/2022/172800a058/1DDCpFj1ztC,"Building software systems often requires knowledge and skills beyond what developers already possess. In such cases, developers have to leverage different sources of information to seek help. A growing number of researchers and practitioners have started investigating what programming-related information developers seek during software development. However, being a high level and a type of the most important development-related information, architectural information search activity is seldom explored. To fill this gap, we conducted an industrial survey completed by 103 participants to understand how developers search for architectural information to solve their architectural problems in development. Our main findings are: (1) searching for architectural information to learn about the pros and cons of certain architectural solutions (e.g., patterns, tactics) and to make an architecture decision among multiple choices are the most frequent purposes or tasks; (2) developers find difficulties mostly in getting relevant architectural information for addressing quality concerns and making design decisions among multiple choices when seeking architectural information; (3) taking too much time to go through architectural information retrieved from various sources and feeling overwhelmed due to the dispersion and abundance of architectural information in various sources are the top two major challenges developers face when searching for architectural information. Our findings (1) provide researchers with future directions, such as the design and development of approaches and tools for searching architectural information from multiple sources, and (2) can be used to provide guidelines for practitioners to refer to when seeking architectural information and providing architectural information that could be considered useful.",ICSA
6,2022,"Vale, Guilherme; Correia, Filipe Figueiredo; Guerra, Eduardo Martins; Rosa, Thatiane de Oliveira; Fritzsch, Jonas; Bogner, Justus",Designing Microservice Systems Using Patterns: An Empirical Study on Quality Trade-Offs,https://www.computer.org/csdl/proceedings-article/icsa/2022/172800a069/1DDCqG1wwlq,"The promise of increased agility, autonomy, scalability, and reusability has made the microservices architecture a de facto standard for the development of large-scale and cloud-native commercial applications. Software patterns are an important design tool, and often they are selected and combined with the goal of obtaining a set of desired quality attributes. However, from a research standpoint, many patterns have not been widely validated against industry practice, making them not much more than interesting theories. To address this, we investigated how practitioners perceive the impact of 14 patterns on 7 quality attributes. Hence, we conducted 9 semi-structured interviews to collect industry expertise regarding (1) knowledge and adoption of software patterns, (2) the perceived architectural trade-offs of patterns, and (3) metrics professionals use to measure quality attributes. We found that many of the trade-offs reported in our study matched the documentation of each respective pattern, and identified several gains and pains which have not yet been reported, leading to novel insight about microservice patterns.",ICSA
7,2022,"Ersoy, Ersin; Sözer, Hasan",Effort Estimation for Architectural Refactoring of Data Tier Software,https://www.computer.org/csdl/proceedings-article/icsa/2022/172800a080/1DDCrQ4enaE,"Architectural refactoring requires substantial effort. We introduce an approach and a tool to predict this effort prior to refactoring. We focus on PL/SQL programs that are developed as data access tiers of business software. There are two types of common refactoring needs for these programs. First, some of the modules might need to be migrated to a separate database. Second, some of the modules in the data tier might need to be migrated to the application tier. In both cases, the refactoring effort is proportional to the amount of coupling between the migrated modules and the rest of the modules in the database. Our tool can parse PL/SQL programs to reveal this coupling based on an analysis of SQL queries. Unlike prior studies, our tool can analyze queries that are created dynamically and that use multiple tables as well as PL/SQL-specific features. We evaluate our approach with an industrial PL/SQL program from the telecommunications domain. Our results are approved to be accurate by domain experts.",ICSA
8,2022,"Warnett, Stephen John; Zdun, Uwe",Architectural Design Decisions for Machine Learning Deployment,https://www.computer.org/csdl/proceedings-article/icsa/2022/172800a090/1DDCpcusgNy,"Deploying machine learning models to production is challenging, partially due to the misalignment between software engineering and machine learning disciplines but also due to potential practitioner knowledge gaps. To reduce this gap and guide decision-making, we conducted a qualitative investigation into the technical challenges faced by practitioners based on studying the grey literature and applying the Straussian Grounded Theory research method. We modelled current practices in machine learning, resulting in a UML-based architectural design decision model based on current practitioner understanding of the domain and a subset of the decision space and identified seven architectural design decisions, various relations between them, twenty-six decision options and forty-four decision drivers in thirty-five sources. Our results intend to help bridge the gap between science and practice, increase understanding of how practitioners approach deployment of their solutions, and support practitioners in their decision-making.",ICSA
9,2022,"Palliwar, Aashay; Pinisetty, Srinivas",Using Gossip Enabled Distributed Circuit Breaking for Improving Resiliency of Distributed Systems,https://www.computer.org/csdl/proceedings-article/icsa/2022/172800a013/1DDCrYz3SAo,"Distributed systems are rife with failures. Several resiliency patterns are used to improve the ability of these systems to tolerate faults and maintain functionality. The circuit breaker pattern is a popular resiliency pattern that is especially suitable for the case when the faults causing dependency failures take a variable amount of time to resolve. In this paper, we propose a modification to the traditional circuit breaker pattern. We also propose a gossip-based information dissemination protocol that enables the (modified) circuit breakers deployed on multiple client-service instances to take a concerted and more informed decision when a common dependency is facing persistent failures. We formally model the client-server systems that use traditional and the proposed distributed circuit breaker patterns in UPPAAL to analyze and compare their performance. The statistical model checking queries performed on the models show that, as compared to the traditional circuit breaker pattern, the distributed version results in fewer unsuccessful requests, that consume system/network resources, with practically the same total execution time under various availability conditions - only at the famously low cost of a robust gossip-based information dissemination protocol.",ICSA
10,2022,"Ivers, James; Seifried, Chris; Ozkaya, Ipek",Untangling the Knot: Enabling Architecture Evolution with Search-Based Refactoring,https://www.computer.org/csdl/proceedings-article/icsa/2022/172800a101/1DDCqgDhaXC,"Software-reliant systems need to evolve over time to meet new requirements and take advantage of new technology. However, all too often the structure of software becomes too complex to allow rapid and cost-effective improvements. This increasing complexity is often also a sign of degrading software architecture, making isolating a portion of software for use in a new context or for clean replacement by an improved version difficult. Isolating entangled software from the rest of the architecture typically relies on manual efforts to refactor code that can take thousands of days of effort, as tools provide only limited support for such activities. In this paper, we describe a search-based algorithm that recommends a series of refactorings that collectively isolate specified software from its tangle of architectural dependencies. This approach generates recommendations that reduce problematic dependencies by more than 87% on codebases as large as 1.2M LOC and has the potential to reduce the effort required for this kind of architecture improvement by two-thirds. In walkthroughs, developers found more than 84% of the recommended refactorings acceptable. Our approach provides a much needed foundation for tool support that addresses challenges commonly encountered when improving the architecture of existing software.",ICSA
11,2022,"Timperley, Christopher S.; Dürschmid, Tobias; Schmerl, Bradley; Garlan, David; Goues, Claire Le",ROSDiscover: Statically Detecting Run-Time Architecture Misconfigurations in Robotics Systems,https://www.computer.org/csdl/proceedings-article/icsa/2022/172800a112/1DDCrotJzlS,"Robot systems are growing in importance and complexity. Ecosystems for robot software, such as the Robot Operating System (ROS), provide libraries of reusable software components that can be configured and composed into larger systems. To support compositionality, ROS uses late binding and architecture configuration via “launch files” that describe how to initialize the components in a system. However, late binding often leads to systems failing silently due to misconfiguration, for example by misrouting or dropping messages entirely.In this paper we present ROSDiscover, which statically recovers the run-time architecture of ROS systems to find such architecture misconfiguration bugs. First, ROSDiscover constructs component level architectural models (ports, parameters) from source code. Second, architecture configuration files are analyzed to compose the system from these component models and derive the connections in the system. Finally, the reconstructed architecture is checked against architectural rules described in first-order logic to identify potential misconfigurations.We present an evaluation of ROSDiscover on real world, off-the-shelf robotic systems, measuring the accuracy, effectiveness, and practicality of our approach. To that end, we collected the first data set of architecture configuration bugs in ROS from popular open-source systems and measure how effective our approach is for detecting configuration bugs in that set.",ICSA
12,2022,"Moghaddam, Mahyar T.; Muccini, Henry; Dugdale, Julie; Kjægaard, Mikkel Baun",Designing Internet of Behaviors Systems,https://www.computer.org/csdl/proceedings-article/icsa/2022/172800a124/1DDCs9neOGI,"The Internet of Behaviors (IoB) puts human behavior at the core of engineering intelligent connected systems. IoB links the digital world to human behavior to integrate human-driven design, development, and adaptation processes. This paper defines the novel IoB concept with a constructed model based on a collective effort interacting with software engineers, human-computer interaction scientists, social scientists, and cognitive science communities. The model for IoB is created based on an exploratory study that synthesizes state-of-the-art analysis and experts interviews. The architecture of a real industry 4.0 manufacturing infrastructure helps to explain the IoB model and its application. The conceptual model was used to successfully implement a socio-technical infrastructure for a crowd monitoring and queue management system for the Uffizi Galleries, Florence, Italy. The experiment, which started in the fall of 2016 and was operational in the fall of 2018, used a data-driven approach to feed the system with real-time sensory data. It also incorporated prediction models on visitors’ mobility behavior. The system’s main objective was to capture human behavior, model it, and build a mechanism that considers changes, adapts in real-time, and continuously learns from repetitive behaviors. In addition to the conceptual model and the real-life evaluation, this paper provides recommendations from experts and gives future directions for IoB to become a significant technological advancement in the coming years.",ICSA
13,2022,"Zaragoza, Pascal; Seriai, Abdelhak-Djamel; Seriai, Abderrahmane; Shatnawi, Anas; Derras, Mustapha",Leveraging the Layered Architecture for Microservice Recovery,https://www.computer.org/csdl/proceedings-article/icsa/2022/172800a135/1DDCsuqXD1u,"The microservice-oriented architecture (MSA) is an architectural style which involves organizing an application as of small independent services, each oriented towards one business functionality while being data autonomous. In pursuit of modernizing their software to take advantage of the Cloud, companies have been eager to migrate their monolithic legacy software towards an MSA. This migration necessitates an identification phase to reorganize classes around the monolith’s functionalities as a set of microservice candidates. However, most identification approaches fail to utilize the monolith’s internal multilayered architecture to identify those functionalities, and thus the microservices. As a consequence, ignoring the internal multilayered architecture increases the risk of identifying microservice by their technical layer which is recognized as a conceptual anti-pattern. In this paper, we explore the impact of the multi-layer architecture in monolithic applications during the identification to develop a semi-automatic approach that relies on it to identify an MSA. Particularly, we analyze the presentation layer to determine the endpoints of each business functionality of the monolith. From these endpoints, we apply a vertical decomposition to identify the necessary classes to implement each feature as a microservice. In the process, we also define the bounded context of each microservice during the vertical decomposition of the data-access layer. For the evaluation, we implemented a model-driven process and applied it on a set of varying open-source applications commonly used in the literature. We compared the results of approach with and without the reverse-engineering of the internal architecture to measure the impact of our approach on the identification of quality microservices. Using decomposition metrics (e.g., MoJoFM, c2ccvg), we were able to measure a significant positive impact.",ICSA
14,2022,"Chondamrongkul, Nacha; Sun, Jing",Architectural Refactoring for Functional Properties in Evolutionary Architecture,https://www.computer.org/csdl/proceedings-article/icsa/2022/172800a146/1DDCq8oUp5C,"The evolutionary architecture supports software systems to make small functional changes frequently and reliably. With fitness functions defined, we can ensure that the architectural goals are met as the system evolves. However, some functionality changes cause architectural changes, which impact a large part of the software system. Therefore, we aim at ensuring that changes in the architectural design do not impact the existing functionalities, while new functionalities are incorporated into the new design. This paper proposes an approach to automate architectural design refactoring that supports changes in functionalities. Our approach applies formal modeling and verification to refactor and verify the evolution process of software systems. The proposed algorithms help to automatically refactor the design by referencing the given architecture design. With our appproach, the evolution process can be planned and formally verified to guarantee that the system can evolve safely to support functionality changes. We evaluated our approach with four real-world systems. The results show the effectiveness of our refactoring approach to support new functional properties.",ICSA
15,2022,"Konersmann, Marco; Kaplan, Angelika; Kühn, Thomas; Heinrich, Robert; Koziolek, Anne; Reussner, Ralf; Jürjens, Jan; al-Doori, Mahmood; Boltz, Nicolas; Ehl, Marco; Fuchs, Dominik; Groser, Katharina; Hahner, Sebastian; Keim, Jan; Lohr, Matthias; Sağlam, Timur; Schulz, Sophie; Töberg, Jan-Philipp",Evaluation Methods and Replicability of Software Architecture Research Objects,https://www.computer.org/csdl/proceedings-article/icsa/2022/172800a157/1DDCqozc1nq,"Context: Software architecture (SA) as research area experienced an increase in empirical research, as identified by Galster and Weyns in 2016 [1]. Empirical research builds a sound foundation for the validity and comparability of the research. A current overview on the evaluation and replicability of SA research objects could help to discuss our empirical standards as a community. However, no such current overview exists.Objective: We aim at assessing the current state of practice of evaluating SA research objects and replication artifact provision in full technical conference papers from 2017 to 2021.Method: We first create a categorization of papers regarding their evaluation and provision of replication artifacts. In a systematic literature review (SLR) with 153 papers we then investigate how SA research objects are evaluated and how artifacts are made available.Results: We found that technical experiments (28%) and case studies (29%) are the most frequently used evaluation methods over all research objects. Functional suitability (46% of evaluated properties) and performance (29%) are the most evaluated properties. 17 papers (11%) provide replication packages and 97 papers (63%) explicitly state threats to validity. 17% of papers reference guidelines for evaluations and 14% of papers reference guidelines for threats to validity.Conclusions: Our results indicate that the generalizability and repeatability of evaluations could be improved to enhance the maturity of the field; although, there are valid reasons for contributions to not publish their data. We derive from our findings a set of four proposals for improving the state of practice in evaluating software architecture research objects. Researchers can use our results to find recommendations on relevant properties to evaluate and evaluation methods to use and to identify reusable evaluation artifacts to compare their novel ideas with other research. Reviewers can use our results to compare the evaluation and replicability of submissions with the state of the practice.",ICSA
