ID,Year,Author,Title,Url,Abstract,Conference
325,2022,"Rong, Guoping; Zhang, Yifan; Yang, Lanxin; Zhang, Fuli; Kuang, Hongyu; Zhang, He",Modeling Review History for Reviewer Recommendation: A Hypergraph Approach,https://www.computer.org/csdl/proceedings-article/icse/2022/922100b381/1Ems5hEFiqk,"Modern code review is a critical and indispensable practice in a pull-request development paradigm that prevails in Open Source Software (OSS) development. Finding a suitable reviewer in projects with massive participants thus becomes an increasingly challenging task. Many reviewer recommendation approaches (recommenders) have been developed to support this task which apply a similar strategy, i.e. modeling the review history first then followed by predicting/recommending a reviewer based on the model. Apparently, the better the model reflects the reality in review history, the higher recommender's performance we may expect. However, one typical scenario in a pull-request development paradigm, i.e. one Pull-Request (PR) (such as a revision or addition submitted by a contributor) may have multiple reviewers and they may impact each other through publicly posted comments, has not been modeled well in existing recommenders. We adopted the hypergraph technique to model this high-order relationship (i.e. one PR with multiple reviewers herein) and developed a new recommender, namely HGRec, which is evaluated by 12 OSS projects with more than 87K PRs, 680K comments in terms of accuracy and recommen-dation distribution. The results indicate that HGRec outperforms the state-of-the-art recommenders on recommendation accuracy. Besides, among the top three accurate recommenders, HGRec is more likely to recommend a diversity of reviewers, which can help to relieve the core reviewers' workload congestion issue. Moreover, since HGRec is based on hypergraph, which is a natural and interpretable representation to model review history, it is easy to accommodate more types of entities and realistic relationships in modern code review scenarios. As the first attempt, this study reveals the potentials of hypergraph on advancing the pragmatic solutions for code reviewer recommendation.",ICSE
326,2022,"Yang, Can; Xu, Zhengzi; Chen, Hongxu; Liu, Yang; Gong, Xiaorui; Liu, Baoxu",ModX: Binary Level Partially Imported Third-Party Library Detection via Program Modularization and Semantic Matching,https://www.computer.org/csdl/proceedings-article/icse/2022/922100b393/1Ems20OzgxW,"With the rapid growth of software, using third-party libraries (TPLs) has become increasingly popular. The prosperity of the library us-age has provided the software engineers with a handful of methods to facilitate and boost the program development. Unfortunately, it also poses great challenges as it becomes much more difficult to manage the large volume of libraries. Researches and studies have been proposed to detect and understand the TPLs in the soft-ware. However, most existing approaches rely on syntactic features, which are not robust when these features are changed or deliber-ately hidden by the adversarial parties. Moreover, these approaches typically model each of the imported libraries as a whole, there-fore, cannot be applied to scenarios where the host software only partially uses the library code segments. To detect both fully and partially imported TPLs at the semantic level, we propose Modx, a framework that leverages novel program modularization techniques to decompose the program into fine-grained functionality-based modules. By extracting both syntactic and semantic features, it measures the distance between modules to detect similar library module reuse in the program. Experimental results show that Modx outperforms other modularization tools by distinguishing more coherent program modules with 353% higher module quality scores and beats other TPL detection tools with on average 17% better in precision and 8% better in recall.",ICSE
327,2022,"Liu, Yi; Li, Yuekang; Deng, Gelei; Liu, Yang; Wan, Ruiyuan; Wu, Runchao; Ji, Dandan; Xu, Shiheng; Bao, Minli",Morest: Model-based RESTful API Testing with Execution Feedback,https://www.computer.org/csdl/proceedings-article/icse/2022/922100b406/1EmskiEYK7S,"RESTful APIs are arguably the most popular endpoints for accessing Web services. Blackbox testing is one of the emerging techniques for ensuring the reliability of RESTful APIs. The major challenge in testing RESTful APIs is the need for correct sequences of API operation calls for in-depth testing. To build meaningful operation call sequences, researchers have proposed techniques to learn and utilize the API dependencies based on OpenAPI specifications. However, these techniques either lack the overall awareness of how all the APIs are connected or the flexibility of adaptively fixing the learned knowledge. In this paper, we propose Morest, a model-based RESTful API testing technique that builds and maintains a dynamically updating RESTful-service Property Graph (RPG) to model the behaviors of RESTful-services and guide the call sequence generation. We empirically evaluated Morest and the results demonstrate that Morest can successfully request an average of 152.66%-232.45% more API operations, cover 26.16%-103.24% more lines of code, and detect 40.64%-215.94% more bugs than state-of-the-art techniques. In total, we applied Morest to 6 real-world projects and found 44 bugs (13 of them cannot be detected by existing approaches). Specifically, 2 of the confirmed bugs are from Bitbucket, a famous code management service with more than 6 million users.",ICSE
328,2022,"Gu, Jiazhen; Luo, Xuchuan; Zhou, Yangfan; Wang, Xin",Muffin: Testing Deep Learning Libraries via Neural Architecture Fuzzing,https://www.computer.org/csdl/proceedings-article/icse/2022/922100b418/1EmshAPdGMM,"Deep learning (DL) techniques are proven effective in many chal-lenging tasks, and become widely-adopted in practice. However, previous work has shown that DL libraries, the basis of building and executing DL models, contain bugs and can cause severe con-sequences. Unfortunately, existing testing approaches still cannot comprehensively exercise DL libraries. They utilize existing trained models and only detect bugs in model inference phase. In this work we propose Muffin to address these issues. To this end, Muffin applies a specifically-designed model fuzzing approach, which al-lows it to generate diverse DL models to explore the target library, instead of relying only on existing trained models. Muffin makes differential testing feasible in the model training phase by tailoring a set of metrics to measure the inconsistencies between different DL libraries. In this way, Muffin can best exercise the library code to detect more bugs. To evaluate the effectiveness of Muffin, we conduct experiments on three widely-used DL libraries. The results demonstrate that Muffin can detect 39 new bugs in the latest release versions of popular DL libraries, including Tensorflow, CNTK, and Theano.",ICSE
329,2022,"He, Haochen; Jia, Zhouyang; Li, Shanshan; Yu, Yue; Zhou, Chenglong; Liao, Qing; Wang, Ji; Liao, Xiangke",Multi-Intention-Aware Configuration Selection for Performance Tuning,https://www.computer.org/csdl/proceedings-article/icse/2022/922100b431/1EmrWB7ULlu,"Automatic configuration tuning helps users who intend to improve software performance. However, the auto-tuners are limited by the huge configuration search space. More importantly, they fo-cus only on performance improvement while being unaware of other important user intentions (e.g., reliability, security). To re-duce the search space, researchers mainly focus on pre-selecting performance-related parameters which requires a heavy stage of dynamically running under different configurations to build per-formance models. Given that other important user intentions are not paid attention to, we focus on guiding users in pre-selecting performance-related parameters in general while warning about side-effects on non-performance intentions. We find that the con-figuration document often, if it does not always, contains rich in-formation about the parameters' relationship with diverse user intentions, but documents might also be long and domain-specific. In this paper, we first conduct a comprehensive study on 13 representative software containing 7,349 configuration parame-ters, and derive six types of ways in which configuration parame-ters may affect non-performance intentions. Guided by this study, we design SAFETUNE, a multi-intention-aware method that pre-selects important performance-related parameters and warns about their side-effects on non-performance intentions. Evaluation on target software shows that SAFETUNE correctly identifies 22–26 performance-related parameters that are missed by state-of-the-art tools but have significant performance impact (up to 14.7x). Furthermore, we illustrate eight representative cases to show that SAFETUNE can effectively prevent real-world and critical side-effects on other user intentions.",ICSE
330,2022,"Ahmed, Toufique; Devanbu, Premkumar",Multilingual training for Software Engineering,https://www.computer.org/csdl/proceedings-article/icse/2022/922100b443/1Ems1Sohlde,"Well-trained machine-learning models, which leverage large amounts of open-source software data, have now become an interesting approach to automating many software engineering tasks. Several SE tasks have all been subject to this approach, with performance gradually improving over the past several years with better models and training methods. More, and more diverse, clean, labeled data is better for training; but constructing good-quality datasets is time-consuming and challenging. Ways of augmenting the volume and diversity of clean, labeled data generally have wide applicability. For some languages (e.g., Ruby) labeled data is less abundant; in others (e.g., JavaScript) the available data maybe more focused on some application domains, and thus less diverse. As a way around such data bottlenecks, we present evidence suggesting that human-written code in different languages (which performs the same function), is rather similar, and particularly preserving of identifier naming patterns; we further present evidence suggesting that identifiers are a very important element of training data for software engineering tasks. We leverage this rather fortuitous phenomenon to find evidence that available multilingual training data (across different languages) can be used to amplify performance. We study this for 3 different tasks: code summarization, code retrieval, and function naming. We note that this data-augmenting approach is broadly compatible with different tasks, languages, and machine-learning models.",ICSE
331,2022,"Cao, Sicong; Sun, Xiaobing; Bo, Lili; Wu, Rongxin; Li, Bin; Tao, Chuanqi",MVD: Memory-Related Vulnerability Detection Based on Flow-Sensitive Graph Neural Networks,https://www.computer.org/csdl/proceedings-article/icse/2022/922100b456/1EmserGyXGU,"Memory-related vulnerabilities constitute severe threats to the security of modern software. Despite the success of deep learning-based approaches to generic vulnerability detection, they are still limited by the underutilization of flow information when applied for detecting memory-related vulnerabilities, leading to high false positives. In this paper, we propose MVD, a statement-level Memory-related Vulnerability Detection approach based on flow-sensitive graph neural networks (FS-GNN). FS-GNN is employed to jointly embed both unstructured information (i.e., source code) and structured information (i.e., control- and data-flow) to capture implicit memory-related vulnerability patterns. We evaluate MVD on the dataset which contains 4,353 real-world memory-related vulnerabilities, and compare our approach with three state-of-the-art deep learning-based approaches as well as five popular static analysis-based memory detectors. The experiment results show that MVD achieves better detection accuracy, outperforming both state-of-the-art DL-based and static analysis-based approaches. Furthermore, MVD makes a great trade-off between accuracy and efficiency.",ICSE
332,2022,"Patra, Jibesh; Pradel, Michael",Nalin: learning from Runtime Behavior to Find Name-Value Inconsistencies in Jupyter Notebooks,https://www.computer.org/csdl/proceedings-article/icse/2022/922100b469/1EmslOpqQCY,"Variable names are important to understand and maintain code. If a variable name and the value stored in the variable do not match, then the program suffers from a name-value inconsistency, which is due to one of two situations that developers may want to fix: Either a correct value is referred to through a misleading name, which negatively affects code understandability and maintainability, or the correct name is bound to a wrong value, which may cause unexpected runtime behavior. Finding name-value inconsistencies is hard because it requires an understanding of the meaning of names and knowledge about the values assigned to a variable at runtime. This paper presents Nalin, a technique to automatically detect name-value inconsistencies. The approach combines a dynamic analysis that tracks assignments of values to names with a neural machine learning model that predicts whether a name and a value fit together. To the best of our knowledge, this is the first work to formulate the problem of finding coding issues as a classification problem over names and runtime values. We apply Nalin to 106,652 real-world Python programs, where meaningful names are particularly important due to the absence of statically declared types. Our results show that the classifier detects name-value inconsistencies with high accuracy, that the warnings reported by Nalin have a precision of 80% and a recall of 76% w.r.t. a ground truth created in a user study, and that our approach complements existing techniques for finding coding issues.",ICSE
333,2022,"Yang, Zhou; Shi, Jieke; He, Junda; Lo, David",Natural Attack for Pre-trained Models of Code,https://www.computer.org/csdl/proceedings-article/icse/2022/922100b482/1EmsgmZLzoc,"Pre-trained models of code have achieved success in many important software engineering tasks. However, these powerful models are vulnerable to adversarial attacks that slightly perturb model inputs to make a victim model produce wrong outputs. Current works mainly attack models of code with examples that preserve operational program semantics but ignore a fundamental requirement for adversarial example generation: perturbations should be natural to human judges, which we refer to as naturalness requirement. In this paper, we propose ALERT (Naturalness Aware Attack), a black-box attack that adversarially transforms inputs to make victim models produce wrong outputs. Different from prior works, this paper considers the natural semantic of generated examples at the same time as preserving the operational semantic of original inputs. Our user study demonstrates that human developers consistently consider that adversarial examples generated by ALERT are more natural than those generated by the state-of-the-art work by Zhang et al. that ignores the naturalness requirement. On attacking CodeBERT, our approach can achieve attack success rates of 53.62%, 27.79%, and 35.78% across three downstream tasks: vulnerability prediction, clone detection and code authorship attribution. On GraphCodeBERT, our approach can achieve average success rates of 76.95%, 7.96% and 61.47% on the three tasks. The above outperforms the baseline by 14.07% and 18.56% on the two pretrained models on average. Finally, we investigated the value of the generated adversarial examples to harden victim models through an adversarial fine-tuning procedure and demonstrated the accuracy of CodeBERT and GraphCodeBERT against ALERT-generated adversarial examples increased by 87.59% and 92.32%, respectively.",ICSE
334,2022,"Arteca, Ellen; Harner, Sebastian; Pradel, Michael; Tip, Frank",Nessie: Automatically Testing JavaScript APIs with Asynchronous Callbacks,https://www.computer.org/csdl/proceedings-article/icse/2022/922100b494/1EmrWl7hvtS,"Previous algorithms for feedback-directed unit test generation iteratively create sequences of API calls by executing partial tests and by adding new API calls at the end of the test. These algorithms are challenged by a popular class of APIs: higher-order functions that receive callback arguments, which often are invoked asyn-chronously. Existing test generators cannot effectively test such APIs because they only sequence API calls, but do not nest one call into the callback function of another. This paper presents Nessie, the first feedback-directed unit test generator that supports nesting of API calls and that tests asynchronous callbacks. Nesting API calls enables a test to use values produced by an API that are available only once a callback has been invoked, and is often necessary to ensure that methods are invoked in a specific order. The core contributions of our approach are a tree-based representation of unit tests with callbacks and a novel algorithm to iteratively generate such tests in a feedback-directed manner. We evaluate our approach on ten popular JavaScript libraries with both asynchronous and synchronous callbacks. The results show that, in a comparison with LambdaTester, a state of the art test generation technique that only considers sequencing of method calls, Nessie finds more behavioral differences and achieves slightly higher coverage. Notably, Nessie needs to generate significantly fewer tests to achieve and exceed the coverage achieved by the state of the art.",ICSE
335,2022,"Ye, He; Martinez, Matias; Monperrus, Martin",Neural Program Repair with Execution-based Backpropagation,https://www.computer.org/csdl/proceedings-article/icse/2022/922100b506/1EmsdrxxS5a,"Neural machine translation (NMT) architectures have achieved promising results for automatic program repair. Yet, they have the limitation of generating low-quality patches (e.g., not compilable patches). This is because the existing works only optimize a purely syntactic loss function based on characters and tokens without incorporating program-specific information during neural network weight optimization. In this paper, we propose a novel program repair model called RewardRepair. The core novelty of RewardRepair is to improve NMT-based program repair with a loss function based on program compilation and test execution information, rewarding the network to produce patches that compile and that do not overfit. We conduct several experiments to evaluate RewardRepair showing that it is feasible and effective to use compilation and test execution results to optimize the underlying neural repair model. RewardRepair correctly repairs 207 bugs over four benchmarks. we report on repair success for 121 bugs that are fixed for the first time in the literature. Also, RewardRepair produces up to 45.3% of compilable patches, an improvement over the 39% by the state-of-the-art.",ICSE
336,2022,"Zheng, Haibin; Chen, Zhiqing; Du, Tianyu; Zhang, Xuhong; Cheng, Yao; Ti, Shouling; Wang, Jingyi; Yu, Yue; Chen, Jinyin",NeuronFair: Interpretable White-Box Fairness Testing through Biased Neuron Identification,https://www.computer.org/csdl/proceedings-article/icse/2022/922100b519/1Ems0oUChe8,"Deep neural networks (DNNs) have demonstrated their outper-formance in various domains. However, it raises a social concern whether DNNs can produce reliable and fair decisions especially when they are applied to sensitive domains involving valuable re-source allocation, such as education, loan, and employment. It is crucial to conduct fairness testing before DNNs are reliably de-ployed to such sensitive domains, i.e., generating as many instances as possible to uncover fairness violations. However, the existing testing methods are still limited from three aspects: interpretabil-ity, performance, and generalizability. To overcome the challenges, we propose NeuronFair, a new DNN fairness testing framework that differs from previous work in several key aspects: (1) inter-pretable - it quantitatively interprets DNNs' fairness violations for the biased decision; (2) effective - it uses the interpretation results to guide the generation of more diverse instances in less time; (3) generic - it can handle both structured and unstructured data. Extensive evaluations across 7 datasets and the corresponding DNNs demonstrate NeuronFair's superior performance. For instance, on structured datasets, it generates much more instances (~ ×5.84) and saves more time (with an average speedup of 534.56%) compared with the state-of-the-art methods. Besides, the instances of NeuronFair can also be leveraged to improve the fairness of the biased DNNs, which helps build more fair and trustworthy deep learning systems. The code of NeuronFair is open-sourced at https:/github.com/haibinzheng/NeuronFair.",ICSE
337,2022,"Lee, Junhee; Hong, Seongjoon; Oh, Hakjoo",NPEX: Repairing Java Null Pointer Exceptions without Tests,https://www.computer.org/csdl/proceedings-article/icse/2022/922100b532/1Ems7ss8T9S,"We present NPEX, a new technique for repairing Java null pointer exceptions (NPEs) without tests. State-of-the-art NPE repair techniques rely on test suites written by developers for patch validation. Unfortunately, however, those are typically future test cases that are unavailable at the time bugs are reported or insufficient to identify correct patches. Unlike existing techniques, NPEX does not require test cases; instead, NPEX automatically infers the repair specification of the buggy program and uses the inferred specification to validate patches. The key idea is to learn a statistical model that predicts how developers would handle NPEs by mining null-handling patterns from existing codebases, and to use a variant of symbolic execution that can infer the repair specification from the buggy program using the model. We evaluated NPEX on real-world NPEs collected from diverse open-source projects. The results show that NPEX significantly outperforms the current state-of-the-art.",ICSE
338,2022,"Li, Zhenming; Wang, Ying; Lin, Zeqi; Cheung, Shing-Chi; Lou, Jian-Guang",Nufix: Escape From NuGet Dependency Maze,https://www.computer.org/csdl/proceedings-article/icse/2022/922100b545/1EmrSjcBSc8,"Developers usually suffer from dependency maze (DM) issues, i.e., package dependency constraints are violated when a project's platform or dependencies are changed. This problem is especially serious in. NET ecosystem due to its fragmented platforms (e.g.,. NET Framework,. NET Core, and. NET Standard). Fixing DM issues is challenging due to the complexity of dependency constraints: multiple DM issues often occur in one project; solving one DM issue usually causes another DM issue cropping up; the exponential search space of possible dependency combinations is also a barrier. In this paper, we aim to help. NET developers tackle the DM issues. First, we empirically studied a set of real DM issues, learning their common fixing strategies and developers' preferences in adopting these strategies. Based on these findings, we propose NuFIX, an automated technique to repair DM issues. NUFIX formulates the repair task as a binary integer linear optimization problem to effectively derive an optimal fix in line with the learnt developers' preferences. The experiment results and expert validation show that NUFIX can generate high-quality fixes for all the DM issues with 262 popular. NET projects. Encouragingly, 20 projects (including affected projects such as Dropbox) have approved and merged our generated fixes, and shown great interests in our technique.",ICSE
339,2022,"Li, Bolun; Xu, Hao; Zhao, Qidong; Su, Pengfei; Chabbi, Milind; Jiao, Shuyin; Liu, Xu",OJXPERF: Featherlight Object Replica Detection for Java Programs,https://www.computer.org/csdl/proceedings-article/icse/2022/922100b558/1Ems7Ujo1Es,"Memory bloat is an important source of inefficiency in complex production software, especially in software written in managed languages such as Java. Prior approaches to this problem have focused on identifying objects that outlive their life span. Few studies have, however, looked into whether and to what extent myriad objects of the same type are identical. A quantitative assessment of identical objects with code-level attribution can assist developers in refactoring code to eliminate object bloat, and favor reuse of existing object(s). The result is reduced memory pressure, reduced allocation and garbage collection, enhanced data locality, and reduced re-computation, all of which result in superior performance. We develop OJXPerf, a lightweight sampling-based profiler, which probabilistically identifies identical objects. OJXPerf employs hardware performance monitoring units (PMU) in conjunction with hardware debug registers to sample and compare field values of different objects of the same type allocated at the same calling context but potentially accessed at different program points. The result is a lightweight measurement – a combination of object allocation contexts and usage contexts ordered by duplication frequency. This class of duplicated objects is relatively easier to optimize. OJXPerf incurs 9% runtime and 6% memory overheads on average. We empirically show the benefit of OJXPerf by using its profiles to instruct us to optimize a number of Java programs, including well-known benchmarks and real-world applications. The results show a noticeable reduction in memory usage (up to 11%) and a significant speedup (up to 25%).",ICSE
