ID,Year,Author,Title,Url,Abstract,Conference
172,2023,"Mondal, Saikat; Rahman, Mohammad Masudur; Roy, Chanchal K.",Do Subjectivity and Objectivity Always Agreeƒ A Case Study with Stack Overflow Questions,https://www.computer.org/csdl/proceedings-article/msr/2023/118400a389/1OIL09gDXVu,"In Stack Overflow (SO), the quality of posts (i.e., questions and answers) is subjectively evaluated by users through a voting mechanism. The net votes (upvotes − downvotes) obtained by a post are often considered an approximation of its quality. However, about half of the questions that received working solutions got more downvotes than upvotes. Furthermore, about 18% of the accepted answers (i.e., verified solutions) also do not score the maximum votes. All these counter-intuitive findings cast doubts on the reliability of the evaluation mechanism employed at SO. Moreover, many users raise concerns against the evaluation, especially downvotes to their posts. Therefore, rigorous verification of the subjective evaluation is highly warranted to ensure a non-biased and reliable quality assessment mechanism. In this paper, we compare the subjective assessment of questions with their objective assessment using 2.5 million questions and ten text analysis metrics. According to our investigation, four objective metrics agree with the subjective evaluation, two do not agree, one either agrees or disagrees, and the remaining three neither agree nor disagree with the subjective evaluation. We then develop machine learning models to classify the promoted and discouraged questions. Our models outperform the state-of-the-art models with a maximum of about 76%–87% accuracy.",MSR
173,2023,"Vargovich, Joseph; Santos, Fabio; Penney, Jacob; Gerosa, Marco A.; Steinmacher, Igor",GiveMeLabeledIssues: An Open Source Issue Recommendation System,https://www.computer.org/csdl/proceedings-article/msr/2023/118400a402/1OIKYDZZK5a,"Developers often struggle to navigate an Open Source Software (OSS) project’s issue-tracking system and find a suitable task. Proper issue labeling can aid task selection, but current tools are limited to classifying the issues according to their type (e.g., bug, question, good first issue, feature, etc.). In contrast, this paper presents a tool (GiveMeLabeledIssues) that mines project repositories and labels issues based on the skills required to solve them. We leverage the domain of the APIs involved in the solution (e.g., User Interface (UI), Test, Databases (DB), etc.) as a proxy for the required skills. GiveMeLabeledIssues facilitates matching developers’ skills to tasks, reducing the burden on project maintainers. The tool obtained a precision of 83.9% when predicting the API domains involved in the issues. The replication package contains instructions on executing the tool and including new projects. A demo video is available at https://www.youtube.com/watch?v=ic2quUue7i8",MSR
174,2023,"Venigalla, Akhila Sri Manasa; Chimalakonda, Sridhar",DocMine: A Software Documentation-Related Dataset of 950 GitHub Repositories,https://www.computer.org/csdl/proceedings-article/msr/2023/118400a407/1OIL5p5jiGQ,"Software documentation is one of the critical aspects of a software project, that could support multiple tasks throughout the software development life-cycle. There is extensive research on understanding issues and challenges with existing documentation, which is typically available as readme files. In projects that support collaborative development, such as those on GitHub, other software artifacts such as commits, pull requests and issues, apart from the conventional readme files, wikis and source code comments, also contain useful information, that supports in understanding, using, extending and maintaining the project. However, we are not aware of any dataset that explicitly focuses on documentation-related information in multiple software artifacts such as readme files, commits and pull requests across a repository. To address this concern and to facilitate further research in software documentation, we present DocMine, as a dataset of documentation-related information, extracted from around 1.35M software artifacts in 950 GitHub repositories, spanning across four different programming languages. The dataset along with its documentation is made available in CSV and .sql formats at - https://doi.org/10.5281/zenodo.5195084.",MSR
175,2023,"Sridharan, Murali; Rantala, Leevi; Mäntylä, Mika","PENTACET data - 23 Million Contextual Code Comments and 250,000 SATD comments",https://www.computer.org/csdl/proceedings-article/msr/2023/118400a412/1OIL1uhsIpi,"Most Self-Admitted Technical Debt (SATD) research utilizes explicit SATD features such as ‘TODO’ and ‘FIXME’ for SATD detection. A closer look reveals several SATD research uses simple SATD (‘Easy to Find’) code comments without contextual data (preceding and succeeding source code context). This work addresses this gap through PENTACET (or 5C dataset) data. PENTACET is a large Curated Contextual Code Comments per Contributor and the most extensive SATD data. We mine 9,096 Open Source Software Java projects totaling over 400 million LOC. The outcome is a dataset with 23 million code comments, preceding and succeeding source code context for each comment, and more than 250,000 SATD comments, including both ‘Easy to Find’ and ‘Hard to Find’ SATD. We believe PENTACET data will further SATD research using Artificial Intelligence techniques.",MSR
176,2023,"Oliveira, Anderson; Correia, João; Sousa, Leonardo; Assunção, Wesley K. G.; Coutinho, Daniel; Garcia, Alessandro; Oizumi, Willian; Barbosa, Caio; Uchôa, Anderson; Pereira, Juliana Alves",Don’t Forget the Exception! : Considering Robustness Changes to Identify Design Problems,https://www.computer.org/csdl/proceedings-article/msr/2023/118400a417/1OIL2PNMWkg,"Modern programming languages, such as Java, use exception-handling mechanisms to guarantee the robustness of software systems. Although important, the quality of exception code is usually poor and neglected by developers. Indiscriminate robustness changes (e.g., the addition of empty catch blocks) can indicate design decisions that negatively impact the internal quality of software systems. As it is known in the literature, multiple occurrences of poor code structures, namely code smells, are strong indicators of design problems. Still, existing studies focus mainly on the correlation of maintainability smells with design problems. However, using only these smells may not be enough since developers need more context (e.g., system domain) to identify the problems in certain scenarios. Moreover, these studies do not explore how changes in the exceptional code of the methods combined with maintainability smells can give complementary evidence of design problems. By covering both regular and exception codes, the developer can have more context about the system and find complementary code smells that reinforce the presence of design problems. This work aims to leverage the identification of design problems by tracking poor robustness changes combined with maintainability smells. We investigated the correlation between robustness changes and maintainability smells on the commit history of more than 160k methods from different releases of 10 open-source software systems. We observed that maintainability smells can be worsened or even introduced when robustness changes are performed. This scenario mainly happened for the smells Feature Envy, Long Method, and Dispersed Coupling. We also analyzed the co-occurrence between robustness and maintainability smells. We identified that the empty catch block and catch throwable robustness smells were the ones that co-occurred the most with maintainability smells related to the Concern Overload and Misplaced Concern design problems. The contribution of our work is to reveal that poor exception code, usually neglected by developers, negatively impacts the quality of methods and classes, signaled by the maintainability smells. Therefore, existing code smell detecting tools can be enhanced to leverage robustness changes to identify design problems.",MSR
177,2023,"Ma, Wenhao; Yu, Yaoxiang; Ruan, Xiaoming; Cai, Bo",Pre-trained Model Based Feature Envy Detection,https://www.computer.org/csdl/proceedings-article/msr/2023/118400a430/1OIL104SXjG,"Code smells slow down software system development and makes them harder to maintain. Existing research aims to develop automatic detection algorithms to reduce the labor and time costs within the detection process. Deep learning techniques have recently been demonstrated to enhance the performance of recognizing code smells even more than metric-based heuristic detection algorithms. As large-scale pre-trained models for Programming Languages (PL), such as CodeT5, have lately achieved the top results in a variety of downstream tasks, some researchers begin to explore the use of pre-trained models to extract the contextual semantics of code to detect code smells. However, little research has employed contextual code semantics relationship between code snippets obtained by pre-trained models to identify code smells. In this paper, we investigate the use of the pre-trained model CodeT5 to extract semantic relationships between code snippets to detect feature envy, which is one of the most common code smells. In addition, to investigate the performance of these semantic relationships extracted by pre-trained models of different architectures on detecting feature envy, we compare CodeT5 with two other pre-trained models CodeBERT and CodeGPT. We have performed our experimental evaluation on ten open-source projects, our approach improves F-measure by 29.32% on feature envy detection and 16.57% on moving destination recommendation. Using semantic relations extracted by several pre-trained models to detect feature envy outperforms the state-of-the-art. This shows that using this semantic relation to detect feature envy is promising. To enable future research on feature envy detection, we have made all the code and datasets utilized in this article open source.",MSR
178,2023,"Shanbhag, Shriram; Chimalakonda, Sridhar",An Exploratory Study on Energy Consumption of Dataframe Processing Libraries,https://www.computer.org/csdl/proceedings-article/msr/2023/118400a284/1OIL0N4K9Us,"The energy consumption of machine learning applications and their impact on the environment has recently gained attention as a research area, focusing on the model creation and training/inference phases. The data-oriented stages of the machine learning pipeline, which involve pre-processing, cleaning, and exploratory analysis, are critical components. However, energy consumption during these stages has received limited attention. Dataframe processing libraries play a significant role in these stages, and optimizing their energy consumption is important for reducing environmental impact and operational costs. Therefore, as a first step towards studying their energy efficiency, we investigate and compare the energy consumption of three popular dataframe processing libraries, namely Pandas, Vaex, and Dask. We perform experiments across 21 dataframe processing operations within four categories, utilizing three distinct datasets. Our results indicate that no single library is the most energy-efficient for all tasks, and the choice of a library can have a significant impact on energy consumption based on the types and frequencies of operations performed. The findings of this study suggest the potential for optimization of the energy consumption of data-oriented stages in the machine learning pipeline and warrant further research in this area.",MSR
179,2023,"Duits, Laura; Kashyap, Isha; Bekkink, Joey; Aslam, Kousar; Guzmán, Emitzá",Whistleblowing and Tech on Twitter,https://www.computer.org/csdl/proceedings-article/msr/2023/118400a296/1OIL4yVWy1W,"From airports to banks, healthcare, space crafts, and even amazon services, technology impacts almost every aspect of today’s life. If wrongdoings occur within or in relation to technology, they can have big implications on individuals, groups of people, or society as a whole. Whistleblowers are insiders who expose such wrongdoings— eventually stopping misconducts, such as fraud, endangerment to public health and safety, or damage to the environment. Twitter is a microblogging service that allows millions of users to share their views with people distributed all over the world on a daily basis. Tweets have the potential to contain useful information about whistleblowing in tech, from the general public and whistleblowers. However, until now this point has not been researched.To fill this gap, we conducted an exploratory study on technology-related whistleblowing tweets by manually analysing tweets, utilising descriptive statistics, and machine learning techniques. We mined 7,400 tweets from whistleblowers themselves, as well as news and opinions about certain whistleblowers and whistleblowing cases. Although our results show that only 30% of the tweets in our sample dataset (obtained through specific search terms) contained relevant information about whistleblowing in technology, our analysis shows that tweets provide valuable information for both researchers and companies to understand the public opinion regarding whistleblowing cases. Furthermore, we found that machine learning techniques are promising means for extracting information about whistleblowing in tech from the vast stream of tweets.",MSR
180,2023,"Wickert, Anna-Katharina; Damke, Clemens; Baumgärtner, Lars; Hüllermeier, Eyke; Mezini, Mira",UnGoML: Automated Classification of unsafe Usages in Go,https://www.computer.org/csdl/proceedings-article/msr/2023/118400a309/1OIKVCGJ5pC,"The Go programming language offers strong protection from memory corruption. As an escape hatch of these protections, it provides the unsafe package. Previous studies identified that this unsafe package is frequently used in real-world code for several purposes, e.g., serialization or casting types. Due to the variety of these reasons, it may be possible to refactor specific usages to avoid potential vulnerabilities. However, the classification of unsafe usages is challenging and requires the context of the call and the program’s structure. In this paper, we present the first automated classifier for unsafe usages in Go, UnGoML, to identify what is done with the unsafe package and why it is used. For UnGoML, we built four custom deep learning classifiers trained on a manually labeled data set. We represent Go code as enriched control-flow graphs (CFGs) and solve the label prediction task with one single-vertex and three context-aware classifiers. All three context-aware classifiers achieve a top-1 accuracy of more than 86% for both dimensions, WHAT and WHY. Furthermore, in a set-valued conformal prediction setting, we achieve accuracies of more than 93% with mean label set sizes of 2 for both dimensions. Thus, UnGoML can be used to efficiently filter unsafe usages for use cases such as refactoring or a security audit. UnGoML: https://github.com/stg-tud/UnGoML Artifact: https://dx.doi.org/10.6084/m9.figshare.22293052",MSR
181,2023,"Jungwirth, Gerhard; Saha, Aakanksha; Schröder, Michael; Fiebig, Tobias; Lindorfer, Martina; Cito, Jürgen",Connecting the .dotfiles: Checked-In Secret Exposure with Extra (Lateral Movement) Steps,https://www.computer.org/csdl/proceedings-article/msr/2023/118400a322/1OIL3zTTZ1S,"Personal software configurations, known as dotfiles, are increasingly being shared in public repositories. To understand the security and privacy implications of this phenomenon, we conducted a large-scale analysis of dotfiles repositories on GitHub. Furthermore, we surveyed repository owners to understand their motivations for sharing dotfiles, and their awareness of the security implications. Our mixed-method approach consisted of two parts: (1) We mined 124,230 public dotfiles repositories and inductively searched them for security and privacy flaws. (2) We then conducted a survey of repository owners (n=1,650) to disclose our findings and learn more about the problems and implications. We found that 73.6 % of repositories leak potentially sensitive information, most commonly email addresses (of which we found 1.2 million), but also RSA private keys, API keys, installed software versions, browsing history, and even mail client inboxes. In addition, we found that sharing is mainly ideological (an end in itself) and to show off (""ricing""), in addition to easing machine setup. Most users are confident about the contents of their files and claim to understand the security implications. In response to our disclosures, a small minority (2.2%) will make their repositories private or delete them, but the majority of respondents will continue sharing their dotfiles after taking appropriate actions. Dotfiles repositories are a great tool for developers to share knowledge and communicate – if done correctly. We provide recommendations for users and platforms to make them more secure. Specifically, tools should be used to manage dotfiles. In addition, platforms should work on more sophisticated tests, to find weaknesses automatically and inform the users or control the damage.",MSR
182,2023,"Nguyen, Hoang H.; Nguyen, Nhat-Minh; Xie, Chunyao; Ahmadi, Zahra; Kudendo, Daniel; Doan, Thanh-Nam; Jiang, Lingxiao",MANDO-HGT: Heterogeneous Graph Transformers for Smart Contract Vulnerability Detection,https://www.computer.org/csdl/proceedings-article/msr/2023/118400a334/1OIL1VeMSha,"Smart contracts in blockchains have been increasingly used for high-value business applications. It is essential to check smart contracts' reliability before and after deployment. Although various program analysis and deep learning techniques have been proposed to detect vulnerabilities in either Ethereum smart contract source code or bytecode, their detection accuracy and scalability are still limited. This paper presents a novel framework named MANDO-HGT for detecting smart contract vulnerabilities. Given Ethereum smart contracts, either in source code or bytecode form, and vulnerable or clean, MANDO-HGT custom-builds heterogeneous contract graphs (HCGs) to represent control-flow and/or function-call information of the code. It then adapts heterogeneous graph transformers (HGTs) with customized meta relations for graph nodes and edges to learn their embeddings and train classifiers for detecting various vulnerability types in the nodes and graphs of the contracts more accurately. We have collected more than 55K Ethereum smart contracts from various data sources and verified the labels for 423 buggy and 2,742 clean contracts to evaluate MANDO-HGT. Our empirical results show that MANDO-HGT can significantly improve the detection accuracy of other state-of-the-art vulnerability detection techniques that are based on either machine learning or conventional analysis techniques. The accuracy improvements in terms of F1-score range from 0.7% to more than 76% at either the coarse-grained contract level or the fine-grained line level for various vulnerability types in either source code or bytecode. Our method is general and can be retrained easily for different vulnerability types without the need for manually defined vulnerability patterns.",MSR
183,2023,"Basak, Setu Kumar; Neil, Lorenzo; Reaves, Bradley; Williams, Laurie",SecretBench: A Dataset of Software Secrets,https://www.computer.org/csdl/proceedings-article/msr/2023/118400a347/1OIL2xdlwek,"According to GitGuardian’s monitoring of public GitHub repositories, the exposure of secrets (API keys and other credentials) increased two-fold in 2021 compared to 2020, totaling more than six million secrets. However, no benchmark dataset is publicly available for researchers and tool developers to evaluate secret detection tools that produce many false positive warnings. The goal of our paper is to aid researchers and tool developers in evaluating and improving secret detection tools by curating a benchmark dataset of secrets through a systematic collection of secrets from open-source repositories. We present a labeled dataset of source codes containing 97,479 secrets (of which 15,084 are true secrets) of various secret types extracted from 818 public GitHub repositories. The dataset covers 49 programming languages and 311 file types.",MSR
184,2023,"Sun, Weijie; Iwuchukwu, Samuel; Bangash, Abdul Ali; Hindle, Abram",An Empirical Study to Investigate Collaboration Among Developers in Open Source Software (OSS),https://www.computer.org/csdl/proceedings-article/msr/2023/118400a352/1OIL02UEJnW,"The value of teamwork is being recognized by project owners, resulting in an increased acknowledgement of collaboration among developers in software engineering. A good understanding of how developers work together could positively impact software development practices. In this paper, we investigate the collaboration habits of developers in project files by leveraging the World of Code (WoC) dataset and GitHub API. We first identify the collaboration level of developers within the project files, such as the source, test, documentation, and build files, using the Author Cross Entropy (ACE). From the results we find out that test files report the highest degree of collaboration among the developers, perhaps because collaboration is critical to ensure convergence of functionality tests. Furthermore, the source code files show the least degree of collaboration, perhaps because of code ownership and the complexity and difficulty in code modification. Secondly, given the widespread usage of the Python programming language, we investigate the Python code tokens that are more prone to change and collaboration. Our findings offer insights into the specific project files and Python code tokens that developers typically collaborate on in the open-source community. This information can be used by researchers and developers to enhance existing collaboration platforms and tools.",MSR
185,2023,"Champa, Arifa I.; Rabbi, Md Fazle; Zibran, Minhaz F.; Islam, Md Rakibul",Insights into Female Contributions in Open-Source Projects,https://www.computer.org/csdl/proceedings-article/msr/2023/118400a357/1OIL0r7Xala,This paper presents a large quantitative study of the contributions of females compared to males in open-source projects. Female participation is found substantially low and females are found more engaged in non-coding work compared to men. The findings are statistically significant and are derived from an in-depth analysis of over 10 thousand developers’ contributions to more than 81 million different projects in the World of Code (WoC) infrastructure. The insights from this study are useful in addressing gender disparity in the field.,MSR
186,2023,"Przymus, Piotr; Fejzer, Mikołaj; Narębski, Jakub; Stencel, Krzysztof",The Secret Life of CVEs,https://www.computer.org/csdl/proceedings-article/msr/2023/118400a362/1OIKZibEDRu,"The Common Vulnerabilities and Exposures (CVEs) system is a reference method for documenting publicly known information security weaknesses and exposures. This paper presents a study of the lifetime of CVEs in software projects and the risk factors affecting their existence. The study uses survival analysis to examine how features of programming languages, projects, and CVEs themselves impact the lifetime of CVEs. We suggest avenues for future research to investigate the effect of various factors on the resolution of vulnerabilities.",MSR
187,2023,"Islam, Anisha; Hewage, Nipuni Tharushika; Bangash, Abdul Ali; Hindle, Abram",Evolution of the Practice of Software Testing in Java Projects,https://www.computer.org/csdl/proceedings-article/msr/2023/118400a367/1OIL1HAUeEU,"Software testing helps developers minimize bugs and errors in their code, improving the overall software quality. In 2013, Kochhar et al. analyzed 20,817 software projects in order to study how prevalent the practice of software testing is in open-source projects. They found that projects with more lines of code (LOC) and projects with more developers tend to have more test cases. Additionally, they found a weak positive correlation between the number of test cases and the number of bugs. Since the conclusions of a study might become irrelevant over time because of the latest practices in the relevant fields, in this paper, we investigate if these conclusions remain valid if we re-evaluate Kochhar et al.’s findings on the Java projects that were developed from 2012 to 2021. For evaluation, we use a random sample of 20,000 open-source Java projects each year. Our results show that Kochhar et al.’s conclusions regarding the projects with test cases having more LOC, the weak positive correlation between the number of test cases and authors, and the weak positive correlation between the number of test cases and bugs remain stable until 2021. Our study corroborates Kochhar et al.’s conclusions and helps developers refocus in light of the latest findings regarding the practice of software testing.",MSR
