ID,Year,Author,Title,Url,Abstract,Conference
460,2023,"Liu, Fang; Li, Jia; Zhang, Li",Syntax and Domain Aware Model for Unsupervised Program Translation,https://doi.org/10.1109/ICSE48619.2023.00072,"There is growing interest in software migration as the development of software and society. Manually migrating projects between languages is error-prone and expensive. In recent years, researchers have begun to explore automatic program translation using supervised deep learning techniques by learning from large-scale parallel code corpus. However, parallel resources are scarce in the programming language domain, and it is costly to collect bilingual data manually. To address this issue, several unsupervised programming translation systems are proposed. However, these systems still rely on huge monolingual source code to train, which is very expensive. Besides, these models cannot perform well for translating the languages that are not seen during the pre-training procedure. In this paper, we propose SDA-Trans, a syntax and domain-aware model for program translation, which leverages the syntax structure and domain knowledge to enhance the cross-lingual transfer ability. SDA-Trans adopts unsupervised training on a smaller-scale corpus, including Python and Java monolingual programs. The experimental results on function translation tasks between Python, Java, and C++ show that SDA-Trans outperforms many large-scale pre-trained models, especially for unseen language translation.",ICSE
461,2023,"Mu, Fangwen; Chen, Xiao; Shi, Lin; Wang, Song; Wang, Qing",Developer-Intent Driven Code Comment Generation,https://doi.org/10.1109/ICSE48619.2023.00073,"Existing automatic code comment generators mainly focus on producing a general description of functionality for a given code snippet without considering developer intentions. However, in real-world practice, comments are complicated, which often contain information reflecting various intentions of developers, e.g., functionality summarization, design rationale, implementation details, code properties, etc. To bridge the gap between automatic code comment generation and real-world comment practice, we define Developer-Intent Driven Code Comment Generation, which can generate intent-aware comments for the same source code with different intents. To tackle this challenging task, we propose DOME, an approach that utilizes Intent-guided Selective Attention to explicitly select intent-relevant information from the source code, and produces various comments reflecting different intents. Our approach is evaluated on two real-world Java datasets, and the experimental results show that our approach outperforms the state-of-the-art baselines. A human evaluation also confirms the significant potential of applying DOME in practical usage, enabling developers to comment code effectively according to their own needs.",ICSE
462,2023,"Xu, Shengbin; Yao, Yuan; Xu, Feng; Gu, Tianxiao; Xu, Jingwei; Ma, Xiaoxing",Data Quality Matters: A Case Study of Obsolete Comment Detection,https://doi.org/10.1109/ICSE48619.2023.00074,"Machine learning methods have achieved great success in many software engineering tasks. However, as a data-driven paradigm, how would the data quality impact the effectiveness of these methods remains largely unexplored. In this paper, we explore this problem under the context of just-in-time obsolete comment detection. Specifically, we first conduct data cleaning on the existing benchmark dataset, and empirically observe that with only 0.22% label corrections and even 15.0% fewer data, the existing obsolete comment detection approaches can achieve up to 10.7% relative accuracy improvement. To further mitigate the data quality issues, we propose an adversarial learning framework to simultaneously estimate the data quality and make the final predictions. Experimental evaluations show that this adversarial learning framework can further improve the relative accuracy by up to 18.1% compared to the state-of-the-art method. Although our current results are from the obsolete comment detection problem, we believe that the proposed two-phase solution, which handles the data quality issues through both the data aspect and the algorithm aspect, is also generalizable and applicable to other machine learning based software engineering tasks.",ICSE
463,2023,"Dong, Jinhao; Lou, Yiling; Hao, Dan; Tan, Lin",Revisiting Learning-Based Commit Message Generation,https://doi.org/10.1109/ICSE48619.2023.00075,"Commit messages summarize code changes and help developers understand the intention. To alleviate human efforts in writing commit messages, researchers have proposed various automated commit message generation techniques, among which learning-based techniques have achieved great success in recent years. However, existing evaluation on learning-based commit message generation relies on the automatic metrics (e.g., BLEU) widely used in natural language processing (NLP) tasks, which are aggregated scores calculated based on the similarity between generated commit messages and the ground truth. Therefore, it remains unclear what generated commit messages look like and what kind of commit messages could be precisely generated by existing learning-based techniques. To fill this knowledge gap, this work performs the first study to systematically investigate the detailed commit messages generated by learning-based techniques. In particular, we first investigate the frequent patterns of the commit messages generated by state-of-the-art learning-based techniques. Surprisingly, we find the majority (~90%) of their generated commit messages belong to simple patterns (i.e., addition/removal/fix/avoidance patterns). To further explore the reasons, we then study the impact of datasets, input representations, and model components. We surprisingly find that existing learning-based techniques have competitive performance even when the inputs are only represented by change marks (i.e., ""+""/""-""/""""). It indicates that existing learning-based techniques poorly utilize syntax and semantics in the code while mostly focusing on change marks, which could be the major reason for generating so many pattern-matching commit messages. We also find that the pattern ratio in the training set might also positively affect the pattern ratio of generated commit messages; and model components might have different impact on the pattern ratio.",ICSE
464,2023,"Dai, Hetong; Tang, Yiming; Li, Heng; Shang, Weiyi",PILAR: Studying and Mitigating the Influence of Configurations on Log Parsing,https://doi.org/10.1109/ICSE48619.2023.00077,"The significance of logs has been widely acknowledged with the adoption of various log analysis techniques that assist in software engineering tasks. Many log analysis techniques require structured logs as input while raw logs are typically unstructured. Automated log parsing is proposed to convert unstructured raw logs into structured log templates. Some log parsers achieve promising accuracy, yet they rely on significant efforts from the users to tune the parameters to achieve optimal results. In this paper, we first conduct an empirical study to understand the influence of the configurable parameters of six state-of-the-art log parsers on their parsing results on three aspects: 1) varying the parameters while using the same dataset, 2) keeping the same parameters while using different datasets, and 3) using different samples from the same dataset. Our results show that all these parsers are sensitive to the parameters, posing challenges to their adoption in practice. To mitigate such challenges, we propose PILAR (Parameter Insensitive Log Parser), an entropy-based log parsing approach. We compare PILAR with the existing log parsers on the same three aspects and find that PILAR is the most parameter-insensitive one. In addition, PILAR achieves the second highest parsing accuracy and efficiency among all the state-of-the-art log parsers. This paper paves the road for easing the adoption of log analysis in software engineer practices.",ICSE
465,2023,"Li, Zhenhao; Luo, Chuan; Chen, Tse-Hsun (Peter); Shang, Weiyi; He, Shilin; Lin, Qingwei; Zhang, Dongmei",Did We Miss Something Important? Studying and Exploring Variable-Aware Log Abstraction,https://doi.org/10.1109/ICSE48619.2023.00078,"Due to the sheer size of software logs, developers rely on automated techniques for log analysis. One of the first and most important steps of automated log analysis is log abstraction, which parses the raw logs into a structured format. Prior log abstraction techniques aim to identify and abstract all the dynamic variables in logs and output a static log template for automated log analysis. However, these abstracted dynamic variables may also contain important information that is useful to different tasks in log analysis. In this paper, we investigate the characteristics of dynamic variables and their importance in practice, and explore the potential of a variable-aware log abstraction technique. Through manual investigations and surveys with practitioners, we find that different categories of dynamic variables record various information that can be important depending on the given tasks, the distinction of dynamic variables in log abstraction can further assist in log analysis. We then propose a deep learning based log abstraction approach, named VALB, which can identify different categories of dynamic variables and preserve the value of specified categories of dynamic variables along with the log templates (i.e., variable-aware log abstraction). Through the evaluation on a widely used log abstraction benchmark, we find that VALB outperforms other state-of-the-art log abstraction techniques on general log abstraction (i.e., when abstracting all the dynamic variables) and also achieves a high variable-aware log abstraction accuracy that further identifies the category of the dynamic variables. Our study highlights the potential of leveraging the important information recorded in the dynamic variables to further improve the process of log analysis.",ICSE
466,2023,"Ding, Zishuo; Tang, Yiming; Li, Yang; Li, Heng; Shang, Weiyi",On the Temporal Relations between Logging and Code,https://doi.org/10.1109/ICSE48619.2023.00079,"Prior work shows that misleading logging texts (i.e., the textual descriptions in logging statements) can be counterproductive for developers during their use of logs. One of the most important types of information provided by logs is the temporal information of the recorded system behavior. For example, a logging text may use a perfective aspect to describe a fact that an important system event has finished. Although prior work has performed extensive studies on automated logging suggestions, few of these studies investigate the temporal relations between logging and code. In this work, we make the first attempt to comprehensively study the temporal relations between logging and its corresponding source code. In particular, we focus on two types of temporal relations: (1) logical temporal relations, which can be inferred from the execution order between the logging statement and the corresponding source code; and (2) semantic temporal relations, which can be inferred based on the semantic meaning of the logging text. We first perform qualitative analyses to study these two types of logging-code temporal relations and the inconsistency between them. As a result, we derive rules to detect these two types of temporal relations and their inconsistencies. Based on these rules, we propose a tool named TempoLo to automatically detect the issues of temporal inconsistencies between logging and code. Through an evaluation of four projects, we find that TempoLo can effectively detect temporal inconsistencies with a small number of false positives. To gather developers' feedback on whether such inconsistencies are worth fixing, we report 15 detected instances from these projects to developers. 13 instances from three projects are confirmed and fixed, while two instances of the remaining project are pending at the time of this writing. Our work lays the foundation for describing temporal relations between logging and code and demonstrates the potential for a deeper understanding of the relationship between logging and code.",ICSE
467,2023,"Rong, Guoping; Gu, Shenghui; Shen, Haifeng; Zhang, He; Kuang, Hongyu",How Do Developers' Profiles and Experiences Influence their Logging Practices? An Empirical Study of Industrial Practitioners,https://doi.org/10.1109/ICSE48619.2023.00080,"Logs record the behavioral data of running programs and are typically generated by executing log statements. Software developers generally carry out logging practices with clear intentions and associated concerns (I&Cs). However, I&Cs may not be properly fulfilled in source code as log placement --- specifically determination of a log statement's context and content--- is often susceptible to an individual's profile and experience. Some industrial studies have been conducted to discern developers' main logging I&Cs and the way I&Cs are fulfilled. However, the findings are only based on the developers from a single company in each individual study and hence have limited generalizability. More importantly, there lacks a comprehensive and deep understanding of the relationships between developers' profiles and experiences and their logging practices from a wider perspective. To fill this significant gap, we conducted an empirical study using mixed methods comprising questionnaire surveys, semi-structured interviews, and code analyses with practitioners from a wide range of companies across a variety of industrial domains. Results reveal that while developers share common logging I&Cs and conduct logging practices mainly in the coding stage, their profiles and experiences profoundly influence their logging I&Cs and the way the I&Cs are fulfilled. These findings pave the way to facilitate the acceptance of important logging I&Cs and the adoption of good logging practices by developers.",ICSE
468,2023,"Bouzenia, Islem; Pradel, Michael",When to Say What: Learning to Find Condition-Message Inconsistencies,https://doi.org/10.1109/ICSE48619.2023.00081,"Programs often emit natural language messages, e.g., in logging statements or exceptions raised on unexpected paths. To be meaningful to users and developers, the message, i.e., what to say, must be consistent with the condition under which it gets triggered, i.e., when to say it. However, checking for inconsistencies between conditions and messages is challenging because the conditions are expressed in the logic of the programming language, while messages are informally expressed in natural language. This paper presents CMI-Finder, an approach for detecting condition-message inconsistencies. CMI-Finder is based on a neural model that takes a condition and a message as its input and then predicts whether the two are consistent. To address the problem of obtaining realistic, diverse, and large-scale training data, we present six techniques to generate large numbers of inconsistent examples to learn from automatically. Moreover, we describe and compare three neural models, which are based on binary classification, triplet loss, and fine-tuning, respectively. Our evaluation applies the approach to 300K condition-message statements extracted from 42 million lines of Python code. The best model achieves a precision of 78% at a recall of 72% on a dataset of past bug fixes. Applying the approach to the newest versions of popular open-source projects reveals 50 previously unknown bugs, 19 of which have been confirmed by the developers so far.",ICSE
469,2023,"Huo, Yintong; Su, Yuxin; Lee, Cheryl; Lyu, Michael R.",SemParser: A Semantic Parser for Log Analytics,https://doi.org/10.1109/ICSE48619.2023.00082,"Logs, being run-time information automatically generated by software, record system events and activities with their timestamps. Before obtaining more insights into the run-time status of the software, a fundamental step of log analysis, called log parsing, is employed to extract structured templates and parameters from the semi-structured raw log messages. However, current log parsers are all syntax-based and regard each message as a character string, ignoring the semantic information included in parameters and templates. Thus, we propose the first semantic-based parser SemParser to unlock the critical bottleneck of mining semantics from log messages. It contains two steps, an end-to-end semantics miner and a joint parser. Specifically, the first step aims to identify explicit semantics inside a single log, and the second step is responsible for jointly inferring implicit semantics and computing structural outputs according to the contextual knowledge base of the logs. To analyze the effectiveness of our semantic parser, we first demonstrate that it can derive rich semantics from log messages collected from six widely-applied systems with an average F1 score of 0.985. Then, we conduct two representative downstream tasks, showing that current downstream models improve their performance with appropriately extracted semantics by 1.2%-11.7% and 8.65% on two anomaly detection datasets and a failure identification dataset, respectively. We believe these findings provide insights into semantically understanding log messages for the log analysis community.",ICSE
470,2023,"Ran, Dezhi; Wang, Hao; Wang, Wenyu; Xie, Tao",Badge: Prioritizing UI Events with Hierarchical Multi-Armed Bandits for Automated UI Testing,https://doi.org/10.1109/ICSE48619.2023.00083,"To assure high quality of mobile applications (apps for short), automated UI testing triggers events (associated with UI elements on app UIs) without human intervention, aiming to maximize code coverage and find unique crashes. To achieve high test effectiveness, automated UI testing prioritizes a UI event based on its exploration value (e.g., the increased code coverage of future exploration rooted from the UI event). Various strategies have been proposed to estimate the exploration value of a UI event without considering its exploration diversity (reflecting the variance of covered code entities achieved by explorations rooted from this UI event across its different triggerings), resulting in low test effectiveness, especially on complex mobile apps. To address the preceding problem, in this paper, we propose a new approach named Badge to prioritize UI events considering both their exploration values and exploration diversity for effective automated UI testing. In particular, we design a hierarchical multi-armed bandit model to effectively estimate the exploration value and exploration diversity of a UI event based on its historical explorations along with historical explorations rooted from UI events in the same UI group. We evaluate Badge on 21 highly popular industrial apps widely used by previous related work. Experimental results show that Badge outperforms state-of-the-art/practice tools with 18%-146% relative code coverage improvement and finding 1.19--5.20x unique crashes, demonstrating the effectiveness of Badge. Further experimental studies confirm the benefits brought by Badge's individual algorithms.",ICSE
471,2023,"Feng, Sidong; Xie, Mulong; Chen, Chunyang",Efficiency Matters: Speeding Up Automated Testing with GUI Rendering Inference,https://doi.org/10.1109/ICSE48619.2023.00084,"Due to the importance of Android app quality assurance, many automated GUI testing tools have been developed. Although the test algorithms have been improved, the impact of GUI rendering has been overlooked. On the one hand, setting a long waiting time to execute events on fully rendered GUIs slows down the testing process. On the other hand, setting a short waiting time will cause the events to execute on partially rendered GUIs, which negatively affects the testing effectiveness. An optimal waiting time should strike a balance between effectiveness and efficiency. We propose AdaT, a lightweight image-based approach to dynamically adjust the inter-event time based on GUI rendering state. Given the real-time streaming on the GUI, AdaT presents a deep learning model to infer the rendering state, and synchronizes with the testing tool to schedule the next event when the GUI is fully rendered. The evaluations demonstrate the accuracy, efficiency, and effectiveness of our approach. We also integrate our approach with the existing automated testing tool to demonstrate the usefulness of AdaT in covering more activities and executing more events on fully rendered GUIs.",ICSE
472,2023,"Lemieux, Caroline; Inala, Jeevana Priya; Lahiri, Shuvendu K.; Sen, Siddhartha",CodaMosa: Escaping Coverage Plateaus in Test Generation with Pre-Trained Large Language Models,https://doi.org/10.1109/ICSE48619.2023.00085,"Search-based software testing (SBST) generates high-coverage test cases for programs under test with a combination of test case generation and mutation. SBST's performance relies on there being a reasonable probability of generating test cases that exercise the core logic of the program under test. Given such test cases, SBST can then explore the space around them to exercise various parts of the program. This paper explores whether Large Language Models (LLMs) of code, such as OpenAI's Codex, can be used to help SBST's exploration. Our proposed algorithm, CodaMosa, conducts SBST until its coverage improvements stall, then asks Codex to provide example test cases for under-covered functions. These examples help SBST redirect its search to more useful areas of the search space. On an evaluation over 486 benchmarks, CodaMosa achieves statistically significantly higher coverage on many more benchmarks (173 and 279) than it reduces coverage on (10 and 4), compared to SBST and LLM-only baselines.",ICSE
473,2023,"Wang, Chao; Ko, Ronny; Zhang, Yue; Yang, Yuqing; Lin, Zhiqiang",TaintMini: Detecting Flow of Sensitive Data in Mini-Programs with Static Taint Analysis,https://doi.org/10.1109/ICSE48619.2023.00086,"Mini-programs, which are programs running inside mobile super apps such as WeChat, often have access to privacy-sensitive information, such as location data and phone numbers, through APIs provided by the super apps. This access poses a risk of privacy sensitive data leaks, either accidentally from carelessly programmed mini-programs or intentionally from malicious ones. To address this concern, it is crucial to track the flow of sensitive data in mini-programs for either human analysis or automated tools. Although existing taint analysis techniques have been widely studied, they face unique challenges in tracking sensitive data flows in mini-programs, such as cross-language, cross-page, and cross-mini-program data flows. This paper presents a novel framework, TaintMini, which addresses these challenges by using a novel universal data flow graph approach that captures data flows within and across mini-programs. We have evaluated TaintMini with 238,866 mini-programs and detect 27,184 that contain sensitive data flows. We have also applied TaintMini to detect privacy leakage colluding mini-programs and identify 455 such programs from them that clearly violate privacy policy.",ICSE
474,2023,"Ghaleb, Asem; Rubin, Julia; Pattabiraman, Karthik",AChecker: Statically Detecting Smart Contract Access Control Vulnerabilities,https://doi.org/10.1109/ICSE48619.2023.00087,"As most smart contracts have a financial nature and handle valuable assets, smart contract developers use access control to protect assets managed by smart contracts from being misused by malicious or unauthorized people. Unfortunately, programming languages used for writing smart contracts, such as Solidity, were not designed with a permission-based security model in mind. Therefore, smart contract developers implement access control checks based on their judgment and in an adhoc manner, which results in several vulnerabilities in smart contracts, called access control vulnerabilities. Further, the inconsistency in implementing access control makes it difficult to reason about whether a contract meets access control needs and is free of access control vulnerabilities. In this work, we propose AChecker - an approach for detecting access control vulnerabilities. Unlike prior work, AChecker does not rely on predefined patterns or contract transactions history. Instead, it infers access control implemented in smart contracts via static dataflow analysis. Moreover, the approach performs further symbolic-based analysis to distinguish cases when unauthorized people can obtain control of the contract as intended functionality. We evaluated AChecker on three public datasets of real-world smart contracts, including one which consists of contracts with assigned access control CVEs, and compared its effectiveness with eight analysis tools. The evaluation results showed that AChecker outperforms these tools in terms of both precision and recall. In addition, AChecker flagged vulnerabilities in 21 frequently-used contracts on Ethereum blockchain with 90% precision.",ICSE
