Paper Name,Link,Year,Venue
On the Criterion that a Given System of Deviations from the Probable in the Case of a Correlated System of Variables is Such that it Can be Reasonably Supposed to have Arisen from Random Sampling,https://link-springer-com.proxy-ub.rug.nl/chapter/10.1007/978-1-4612-4380-9_2,1900,Breakthroughs in Statistics
Measurement of Inequality of Incomes,https://www-jstor-org.proxy-ub.rug.nl/stable/2223319?origin=crossref&seq=1,1921,The Economic Journal
The factorial interpretation of test difficulty,https://doi.org/10.1007/BF02288588,1941,10.1007/BF02288588
Use of Ranks in One-Criterion Variance Analysis,https://people.ucalgary.ca/~jefox/Kruskal%20and%20Wallis%201952.pdf,1952,Journal of the American Statistical Association
"The magical number seven, plus or minus two: Some limits on our capacity for processing information",https://psycnet-apa-org.proxy-ub.rug.nl/record/1957-02914-001?doi=1,1956,The Psychological Review
Algorithms for the Assignment and Transportation Problems,https://www-semanticscholar-org.proxy-ub.rug.nl/paper/Algorithms-for-the-Assignment-and-Transportation-Munkres/848c717ba51e48afef714dfef4bd6ab1cc050dab,1957,Journal of The Society for Industrial and Applied Mathematics
A Statistical Approach to Mechanical Encoding and Searching of Literary Information,https://ieeexplore-ieee-org.proxy-ub.rug.nl/document/5392697,1957,IBM Journal of Research and Development
A Coefficient of Agreement for Nomical Scales,https://journals-sagepub-com.proxy-ub.rug.nl/doi/10.1177/001316446002000104,1960,Educational and Psycological Measurement
Cours d'économie politique,https://www-cairn-info.proxy-ub.rug.nl/cours-d-economie-politique-tomes-1-et-2--9782600040143.htm,1964,Book
An Analysis of Variance Test for Normality (Complete Samples),https://www-jstor-org.proxy-ub.rug.nl/stable/2333709?seq=1,1965,Biometrika
Weighted kappa: Nominal scale agreement provision for scaled disagreement or partial credit,https://psycnet-apa-org.proxy-ub.rug.nl/record/1969-00069-001,1968,Journal of the American Psychological Association
On the Criteria To Be Used in Decomposing Systems into Modules,https://www.researchgate.net/publication/200085877_On_the_Criteria_To_Be_Used_in_Decomposing_Systems_into_Modules,1972,Communications of the ACM
Structured design,https://ieeexplore-ieee-org.proxy-ub.rug.nl/document/5388187,1974,IBM Systems Journal
The protection of information in computer systems,https://ieeexplore-ieee-org.proxy-ub.rug.nl/document/1451869,1975,Proceedings of the IEEE
Comparison of the predicted and observed secondary structure of T4 phage lysozyme,https://www.sciencedirect.com/science/article/pii/0005279575901099,1975,10.1016/0005-2795(75)90109-9
A Discipline of Programming,https://www.amazon.com/Discipline-Programming-Edsger-W-Dijkstra/dp/013215871X,1976,Book
Statistical Power Analysis for the Behavioral Sciences,https://www-sciencedirect-com.proxy-ub.rug.nl/book/9780121790608/statistical-power-analysis-for-the-behavioral-sciences,1977,Book
Exploratory Data Analysis ,http://theta.edu.pl/wp-content/uploads/2012/10/exploratorydataanalysis_tukey.pdf,1977,Book
An Assessment of the Scientific Merits of Action Research,https://www-jstor-org.proxy-ub.rug.nl/stable/2392581?origin=crossref&seq=1,1978,Administrative Science Quarterly
Structured Design: Fundamentals of a Discipline of Computer Program and Systems Design,https://www.goodreads.com/book/show/946145.Structured_Design,1979,Book
Hierarchical agglomerative clustering procedure,https://www-sciencedirect-com.proxy-ub.rug.nl/science/article/pii/0031320379900499?via%3Dihub,1979,Pattern Recognition
Make -- a program for maintaining computer programs,https://onlinelibrary-wiley-com.proxy-ub.rug.nl/doi/10.1002/spe.4380090402,1979,Software: Practice and Experience
"Programs, life cycles, and laws of software evolution",https://ieeexplore-ieee-org.proxy-ub.rug.nl/document/1456074?reload=true,1980,Proceedings of the IEEE
Some Stability Measures for Software Maintenance,https://ieeexplore-ieee-org.proxy-ub.rug.nl/document/1702781,1980,IEEE Transactions on Software Engineering
The design structure system: A method for managing the design of complex systems,https://ieeexplore-ieee-org.proxy-ub.rug.nl/document/6448589,1981,IEEE Transactions on Engineering Management
Statistical Modelling of Data on Teaching Styles,https://www-jstor-org.proxy-ub.rug.nl/stable/2981826?origin=crossref&seq=1,1981,Journal of the Royal Statistical Society
On the role of scientific thought,https://dl-acm-org.proxy-ub.rug.nl/doi/abs/10.5555/539053.C1104639,1982,Chapter
Introduction to Modern Information Retrieval,https://sigir.org/files/museum/introduction_to_modern_information_retrieval/frontmatter.pdf,1983,Book
An Essay on Software Reuse,https://ieeexplore-ieee-org.proxy-ub.rug.nl/abstract/document/5010272,1984,IEEE Transactions on Software Engineering
Program Slicing,https://ieeexplore-ieee-org.proxy-ub.rug.nl/document/5010248,1984,IEEE Transactions on Software Engineering
A Methodology for Collecting Valid Software Engineering Data,https://ieeexplore.ieee.org/abstract/document/5010301,1984,10.1109/TSE.1984.5010301
System Structure Analysis: Clustering with Data Bindings,https://ieeexplore-ieee-org.proxy-ub.rug.nl/document/1702084,1985,IEEE Transactions on Software Engineering
A file comparison program,https://onlinelibrary-wiley-com.proxy-ub.rug.nl/doi/10.1002/spe.4380151102,1985,Software: Practice and Experience
Ano(ND) difference algorithm and its variations,https://link-springer-com.proxy-ub.rug.nl/article/10.1007/BF01840446,1986,Algorithmica
"RIGI: A Model For Software System Construction, Integration, And Evolution Based On Module Interface Specifications",https://scholarship.rice.edu/handle/1911/16096,1986,Thesis
The Pareto Principle: Its Use and Abuse,https://www-emerald-com.proxy-ub.rug.nl/insight/content/doi/10.1108/eb024706/full/html,1987,Journal of Services Marketing
The program dependence graph and its use in optimization,https://dl-acm-org.proxy-ub.rug.nl/doi/10.1145/24039.24041,1987,ACM Transactions on Programming Languages and Systems
Efficient randomized pattern-matching algorithms,https://ieeexplore-ieee-org.proxy-ub.rug.nl/document/5390135,1987,IBM Journal of Research and Development
The TAME project: towards improvement-oriented software environments,https://ieeexplore-ieee-org.proxy-ub.rug.nl/document/6156,1988,IEEE Transactions on Software Engineering
Interprocedural slicing using dependence graphs,https://dl-acm-org.proxy-ub.rug.nl/doi/10.1145/960116.53994,1988,TOPLAS
Simple Fast Algorithms for the Editing Distance between Trees and Related Problems,https://epubs-siam-org.proxy-ub.rug.nl/doi/10.1137/0218082,1989,SIAM Journal on Computing
Program understanding: Challenge for the 1990s,https://ieeexplore-ieee-org.proxy-ub.rug.nl/document/5387570,1989,IBM Systems Journal
Toward higher-level abstractions for software systems,https://dl-acm-org.proxy-ub.rug.nl/doi/abs/10.1016/0169-023X%2890%2990008-2,1990,Data & Knowledge Engineering
Identifying the semantic and textual differences between two versions of a program,https://dl-acm-org.proxy-ub.rug.nl/doi/10.1145/93542.93574,1990,PLDI
Introduction to WordNet: An On-line Lexical Database,https://wordnetcode.princeton.edu/5papers.pdf,1990,International Journal of Lexicography
Feature-Oriented Domain Analysis feasability study,https://www.researchgate.net/publication/215588323_Feature-Oriented_Domain_Analysis_FODA_feasibility_study,1990,Technical report
Where does reuse start?,https://dl-acm-org.proxy-ub.rug.nl/doi/10.1145/382296.382702,1990,ACM SIGSOFT Software Engineering Notes
Analyzing error-prone system structure,https://ieeexplore-ieee-org.proxy-ub.rug.nl/document/67595,1991,IEEE Transactions on Software Engineering
Control-flow analysis of higher-order languages of taming lambda,https://dl-acm-org.proxy-ub.rug.nl/doi/10.5555/124950,1991,Thesis
Phi/Phimax: Review and Synthesis,https://doi.org/10.1177/001316449105100403,1991,10.1177/001316449105100403
An intelligent tool for re-engineering software modularity,https://ieeexplore-ieee-org.proxy-ub.rug.nl/document/130626,1991,ICSE
Foundations for the study of software architecture,https://dl-acm-org.proxy-ub.rug.nl/doi/10.1145/141874.141884,1992,SIGSOFT
"The pragmatics of information retrieval experimentation, revisited",https://www-sciencedirect-com.proxy-ub.rug.nl/science/article/pii/030645739290005K?via%3Dihub,1992,Information Processing & Management
Documenting frameworks using patterns,https://dl-acm-org.proxy-ub.rug.nl/doi/10.1145/141937.141943,1992,ACM SIGPLAN Notices
Ridge Estimators in Logistic Regression,https://www-jstor-org.proxy-ub.rug.nl/stable/2347628?seq=1,1992,Applied Statistics
Dominance statistics: Ordinal analyses to answer ordinal questions,https://psycnet-apa-org.proxy-ub.rug.nl/record/1994-08169-001,1993,Journal of the American Psychological Association
Measuring and assessing maintainability at the end of high level design,https://ieeexplore-ieee-org.proxy-ub.rug.nl/document/366952?tp=&signout=success,1993,ICSM 
A translation approach to portable ontology specifications,https://www-sciencedirect-com.proxy-ub.rug.nl/science/article/pii/S1042814383710083,1993,Knowledge Acquisition
A Reverse Engineering Approach To Subsystem Structure Identification,http://citeseerx.ist.psu.edu.proxy-ub.rug.nl/viewdoc/download;jsessionid=48CEF9A3F94479B0A183B9B9F1923DAD?doi=10.1.1.32.1903&rep=rep1&type=pdf,1993,Chapter
PD and joint application design: a transatlantic comparison,https://dl-acm-org.proxy-ub.rug.nl/doi/10.1145/153571.163265,1993,Communications of the ACM
Object-oriented metrics that predict maintainability,https://www-sciencedirect-com.proxy-ub.rug.nl/science/article/pii/016412129390077B,1993,Journal of Systems and Software
Identifying redundancy in source code using fingerprints,https://dl-acm-org.proxy-ub.rug.nl/doi/10.5555/962289.962305,1993,CASCON
Planning for change: a reconfiguration language for distributed systems,https://ieeexplore-ieee-org.proxy-ub.rug.nl/document/289939,1994,Workshop on Configurable Distributed Systems
A metrics suite for object oriented design,https://ieeexplore-ieee-org.proxy-ub.rug.nl/document/295895,1994,IEEE Transactions on Software Engineering
Overview of Teknowledge's domain-specific software architecture program,https://dl-acm-org.proxy-ub.rug.nl/doi/10.1145/190679.190686,1994,ACM SIGSOFT Software Engineering Notes
The Software Architecture Renaissance,https://resources.sei.cmu.edu/library/asset-view.cfm?assetid=30079,1994,Crosstalk - The Journal of Defense Software Engineering
Semantic Diff: a tool for summarizing the effects of modifications,https://ieeexplore-ieee-org.proxy-ub.rug.nl/document/336770,1994,ICSM
C4.5: Programs for Machine Learning,https://link-springer-com.proxy-ub.rug.nl/article/10.1007/BF00993309,1994,Machine Learning
Using metrics to evaluate software system maintainability,https://ieeexplore-ieee-org.proxy-ub.rug.nl/document/303623,1994,Computer
OO Design Quality Metrics - An Analysis of Dependencies,https://linux.ime.usp.br/~joaomm/mac499/arquivos/referencias/oodmetrics.pdf,1994,Workshop Pragmatic and Theoretical Directions in Object-Oriented Software Metrics
Understanding quality in conceptual modeling,https://ieeexplore-ieee-org.proxy-ub.rug.nl/document/268955,1994,IEEE Software
Object-Oriented Analysis and Design With Applications,https://www.amazon.com/Object-Oriented-Analysis-Design-Applications-2nd/dp/0805353402,1994,Book
Software aging,https://ieeexplore.ieee.org/abstract/document/296790,1994,10.1109/ICSE.1994.296790
"Architectural Blueprints - The ""4+1"" View Model of Software Architecture",https://www.researchgate.net/publication/220018231_The_41_View_Model_of_Architecture,1995,IEEE Software
Abstractions for software architecture and tools to support them,https://ieeexplore-ieee-org.proxy-ub.rug.nl/document/385970,1995,IEEE Transactions on Software Engineering
Design patterns: elements of reusable object-oriented software,https://www.amazon.nl/Design-patterns-elements-reusable-object-oriented/dp/0201633612,1995,Book
Software reflexion models: bridging the gap between source and high-level models,https://dl-acm-org.proxy-ub.rug.nl/doi/10.1145/222132.222136,1995,ACM SIGSOFT Software Engineering Notes
Estimating continuous distributions in Bayesian classifiers,https://dl-acm-org.proxy-ub.rug.nl/doi/10.5555/2074158.2074196,1995,UAI
"Mythical Man-Month, Anniversary Edition",https://www.amazon.com/Mythical-Man-Month-Anniversary-Software-Engineering-ebook/dp/B00B8USS14,1995,Book
Structural redocumentation: a case study,https://ieeexplore-ieee-org.proxy-ub.rug.nl/document/363166,1995,IEEE Software
A Multi-Level Algorithm For Partitioning Graphs,https://ieeexplore-ieee-org.proxy-ub.rug.nl/document/1383164,1995,Supercomputing
A study of cross-validation and bootstrap for accuracy estimation and model selection,https://dl-acm-org.proxy-ub.rug.nl/doi/10.5555/1643031.1643047,1995,IJCAI
The power of decision tables,https://link-springer-com.proxy-ub.rug.nl/chapter/10.1007/3-540-59286-5_57,1995,ECML
Program comprehension during software maintenance and evolution,https://ieeexplore-ieee-org.proxy-ub.rug.nl/document/402076,1995,Computer
On finding duplication and near-duplication in large software systems,https://ieeexplore-ieee-org.proxy-ub.rug.nl/document/514697,1995,WCRE
ADLs and Dynamic Architecture Changes ,https://dl-acm-org.proxy-ub.rug.nl/doi/pdf/10.1145/243327.243340,1996,ISAW
Recommended Best Industrial Practice for Software Architecture Evaluation,https://resources.sei.cmu.edu/library/asset-view.cfm?assetid=12653,1996,Technical Report
Software Architecture: Perspectives on an Emerging Disciple,https://books.google.be/books/about/Software_Architecture.html?id=5KlQAAAAMAAJ&hl=nl,1996,Book
A component- and message-based architectural style for GUI software,https://ieeexplore-ieee-org.proxy-ub.rug.nl/document/508313,1996,IEEE Transactions on Software Engineering
Efficient path profiling,https://dl-acm-org.proxy-ub.rug.nl/doi/10.5555/243846.243857,1996,MICRO
A System of Patterns: Pattern-Oriented Software Architecture: 1,https://www.amazon.nl/System-Patterns-Pattern-Oriented-Software-Architecture/dp/0471958697,1996,Book
A validation of object-oriented design metrics as quality indicators,https://ieeexplore-ieee-org.proxy-ub.rug.nl/document/544352,1996,IEEE Transactions on Software Engineering
Change detection in hierarchically structured information,https://dl-acm-org.proxy-ub.rug.nl/doi/10.1145/235968.233366,1996,ACM SIGMOD Record
Property-based software engineering measurement,https://ieeexplore-ieee-org.proxy-ub.rug.nl/document/481535,1996,IEEE Transactions on Software Engineering
Design rationale systems: understanding the issues,https://ieeexplore-ieee-org.proxy-ub.rug.nl/document/592267,1997,IEEE Expert
A formal approach to software architecture,https://dl-acm-org.proxy-ub.rug.nl/doi/10.5555/926062,1997,Book
UML Distilled: Applying the Standard Object Modeling Language,https://books.google.nl/books/about/UML_Distilled.html?id=JdEZAQAAIAAJ&redir_esc=y,1997,Book
The Orphan Adoption problem in architecture maintenance,https://ieeexplore-ieee-org.proxy-ub.rug.nl/document/624578,1997,WCRE
Using clustering algorithms in legacy systems remodularization,https://ieeexplore-ieee-org.proxy-ub.rug.nl/document/624574,1997,WCRE
The measurement of software design quality,https://link-springer-com.proxy-ub.rug.nl/article/10.1023/A:1018914711050,1997,Annals of Software Engineering
Reexamining the fault density component size connection,https://ieeexplore-ieee-org.proxy-ub.rug.nl/document/582978,1997,IEEE Software
Bayesian Network Classifiers,https://link-springer-com.proxy-ub.rug.nl/article/10.1023/A:1007465528199,1997,Machine Learning
File clustering using name conventions for legacy systems,https://dl-acm-org.proxy-ub.rug.nl/doi/10.5555/782010.782012,1997,CASCON
Refinement of information flow architectures,https://ieeexplore-ieee-org.proxy-ub.rug.nl/document/630427,1997,ICFEM
Call graph construction in object-oriented languages,https://dl-acm-org.proxy-ub.rug.nl/doi/10.1145/263700.264352,1997,ACM SIGPLAN Notices
Metrics and laws of software evolution-the nineties view,https://ieeexplore-ieee-org.proxy-ub.rug.nl/document/637156,1997,International Software Metrics Symposium
Cyberspace 2000: dealing with information overload,https://dl.acm.org/doi/10.1145/253671.253680,1997,10.1145/253671.253680
Modelling the application domains of software engineering technologies,https://ieeexplore.ieee.org/abstract/document/632850,1997,10.1109/ASE.1997.632850
Abstract Syntax from Concrete Syntax,https://ieeexplore-ieee-org.proxy-ub.rug.nl/document/610346,1997,ICSE
Rigi: A Visualization Environment for Reverse Engineering,https://ieeexplore-ieee-org.proxy-ub.rug.nl/document/610428,1997,ICSE
If Your Version Control System Could Talk ...,https://www.researchgate.net/publication/2791666_If_Your_Version_Control_System_Could_Talk,1997,ICSE
Software Metrics: A Rigorous and Practical Approach,https://books.google.nl/books?hl=nl&lr=&id=lx_OBQAAQBAJ&oi=fnd&pg=PP1&dq=Software+Metrics:+A+Rigorous+and+Practical+Approach.&ots=_VlRQnSMVB&sig=83nhNzlAwm8BHjcuvUUnZu7-0oU#v=onepage&q=Software%20Metrics%3A%20A%20Rigorous%20and%20Practical%20Approach.&f=false,1998,Book
Describing software architecture styles using graph grammars,https://ieeexplore-ieee-org.proxy-ub.rug.nl/document/708567,1998,IEEE Transactions on Software Engineering
Detection of Logical coupling based on product release history,https://ieeexplore-ieee-org.proxy-ub.rug.nl/document/738508,1998,ICSM 
On combining classifiers,https://ieeexplore-ieee-org.proxy-ub.rug.nl/document/667881,1998,IEEE Transactions on Pattern Analysis and Machine Intelligence
"Patterns and antipatterns, The patterns handbooks",https://www.amazon.nl/Patterns-Handbook-Techniques-Strategies-Applications/dp/0521648181,1998,Book
View extraction and view fusion in architectural understanding,https://ieeexplore-ieee-org.proxy-ub.rug.nl/document/685754,1998,ICSR
Structural manipulations of software architecture using Tarski relational algebra,https://ieeexplore-ieee-org.proxy-ub.rug.nl/document/723191,1998,WCRE
"AntiPatterns: Refactoring Software, Architecture, and Projects in Crisis",https://www.amazon.com/AntiPatterns-William-J-Brown/dp/0471197130,1998,Book
A Fast and High Quality Multilevel Scheme for Partitioning Irregular Graphs,https://epubs-siam-org.proxy-ub.rug.nl/doi/10.1137/S1064827595287997,1998,SIAM Journal on Scientific Computing
Violin Plots: A Box Plot-Density Trace Synergism,https://www-jstor-org.proxy-ub.rug.nl/stable/2685478?origin=crossref&seq=1,1998,The American Statistician
Clone detection using abstract syntax trees,https://ieeexplore-ieee-org.proxy-ub.rug.nl/document/738528,1998,ICSM
What's wrong with Bonferroni adjustments,https://www-bmj-com.proxy-ub.rug.nl/content/316/7139/1236,1998,British Medical Journal
To maintain a reliable software specification,https://ieeexplore.ieee.org/abstract/document/730774,1998,10.1109/ISSRE.1998.730774
AGORA: a search engine for software components,https://ieeexplore.ieee.org/abstract/document/735988,1998,10.1109/4236.735988
Architecture-based runtime software evolution,https://ieeexplore-ieee-org.proxy-ub.rug.nl/document/671114,1998,ICSE
Refactoring: Improving The Design Of Existing Code,https://books.google.nl/books?id=HmrDHwgkbPsC&printsec=frontcover&hl=nl#v=onepage&q&f=false,1999,Book
The Conflict between Notions of Fairness and the Pareto Principle,https://watermark-silverchair-com.proxy-ub.rug.nl/63.pdf?token=AQECAHi208BE49Ooan9kkhW_Ercy7Dm3ZL_9Cf3qfKAc485ysgAAAtgwggLUBgkqhkiG9w0BBwagggLFMIICwQIBADCCAroGCSqGSIb3DQEHATAeBglghkgBZQMEAS4wEQQMnnWAJcAuWn92YdokAgEQgIICixYGoV3LvtJfaOh64h686sYH6bP7Kn5MuW9E3Zcpoi9Kd9paf_SZStSn-Ldfe_TqM8UKQH3l0n15HIVJjbF72UGNK5S0cvG9ewIguVoDPIrYlBv-rQz-MnWHsDKmMT0HtJyCAwhMOfrrtMZRH0i3iwlTKpM5DTeEJm5lX5V9uNqqwOFZKfQOqFYFoGU0TIY0kdzmA7WOctgGD8pNxyj_grvDx8sbzswAHRmqr93QMNb07onK5_w3SlOegpsp4-lpDkAKtj9f6j7EGExoFaLGqycS2PGZPOYDEITGwvfWIQa5NpAItCkdOFkO224QTCuPufPoRbL9wZ2CNohN5lmoGZ58GtBfwbmxSLxLXLlAfwR-v3qTHRVay5e8ww_rmDOcWswORXtJHeqU7tkQiMF7O1BPeqetFcR5CdAGdVdyVI9-ATeyYpzqfsE7ZmPqpFmpTIlJmCsWo8mLlJpBWYbhRkjoyWJXX22sAtgXII-mQhEJKpjghRfLt4leDWecSnz1S0lbB06VTS8cSx17OtyQj-A6ggeaFkdkSg1EHc5eFoO4c1EsWglaiK_A99ZFaQSCS0_v3hrhJTSZJIcwk9OztfTaJ4L9VoBJL4Oo4niAHKjidAHH1Upzy9-PuWXKJO9ZAATkGwf8hLZ4d54IGPCQPBlJa0ukSi0_UWdHl6krRQO7pJvUoLW3A0rDSoZlet0r5Y0kXrMAd6Y5er4HKDxOz7bLNYBHH5rRBY9AcENiFnt0qgfonlR0Dkot4S00229qCs0k9lalGkvhicvxLllKWutzdqPjIfWsUmNQm_5j3QwyXLp9LammedtlzjmdgVDcj-2hI_HuirN6o0ur32rx7VaMxodCpzyUs4gmiA,1999,American Law and Economics review
MoJo: a distance metric for software clusterings,https://ieeexplore-ieee-org.proxy-ub.rug.nl/document/806959,1999,RE
An architecture-based approach to self-adaptive software,https://ieeexplore-ieee-org.proxy-ub.rug.nl/document/769885,1999,IEEE Intelligent Systems and their Applications
Whole program paths,https://dl-acm-org.proxy-ub.rug.nl/doi/10.1145/301631.301678,1999,ACM SIGPLAN Notices
Removing unnecessary synchronization in Java,https://dl-acm-org.proxy-ub.rug.nl/doi/pdf/10.1145/320384.320388,1999,ACM SIGPLAN Notices
Action research,https://dl-acm-org.proxy-ub.rug.nl/doi/10.1145/291469.291479,1999,Communications of the ACM
Foundations of Statistical Natural Language Processing,https://www.amazon.com/Foundations-Statistical-Natural-Language-Processing/dp/0262133601,1999,Book
First Things First: Prioritizing Requirements,https://www-semanticscholar-org.proxy-ub.rug.nl/paper/First-Things-First%3A-Prioritizing-Requirements-Wiegers/7e476e75de1a00911064149584c5bb1c32327aa8,1999,Software Development
Recovering Software Architecture from the names of Source Files,https://www.researchgate.net/publication/220674120_Recovering_Software_Architecture_from_the_Names_of_Source_Files,1999,Journal of Software Maintenance Research and Practice
Forward and reverse repair of software architecture,https://dl-acm-org.proxy-ub.rug.nl/doi/10.5555/781995.782007,1999,CASCON
Playing Detective: Reconstructing Software Architecture from Available Evidence,https://link-springer-com.proxy-ub.rug.nl/article/10.1023/A:1008781513258,1999,Automated Software Engineering
Qualitative methods in empirical studies of software engineering,https://ieeexplore-ieee-org.proxy-ub.rug.nl/document/799955,1999,IEEE Transactions on Software Engineering
Evolution in software product lines: Two cases,https://dl-acm-org.proxy-ub.rug.nl/doi/10.5555/334928.334930,1999,Journal of Software Maintenance: Research and Practice
An approach for measuring software evolution using source code features,https://ieeexplore-ieee-org.proxy-ub.rug.nl/document/809579,1999,ASPEC
Multiple Regression: A Primer,https://www.amazon.com/Multiple-Regression-Research-Methods-Statistics/dp/0761985336,1999,Book
Round-Trip Software Engineering Using UML: From Architecture to Design and Back,https://www-semanticscholar-org.proxy-ub.rug.nl/paper/Round-Trip-Software-Engineering-Using-UML%3A-From-to-Medvidovi%C4%87-Egyed/2716824496d5c1d46cb166abe98b36ea2767e5a0,1999,Article
A language independent approach for detecting duplicated code,https://ieeexplore-ieee-org.proxy-ub.rug.nl/document/792593,1999,ICSM
"Hubs, authorities, and communities",https://dl-acm-org.proxy-ub.rug.nl/doi/10.1145/345966.345982,1999,ACM Computing Surveys
The PageRank Citation Ranking: Bringing Order to the Web,http://ilpubs.stanford.edu:8090/422/,1999,Technical report
Mathematical Methods of Statistics,,1999,
Linux as a case study: its extracted software architecture,https://ieeexplore-ieee-org.proxy-ub.rug.nl/document/841045,1999,ICSE
Experience with performing architecture tradeoff analysis,https://ieeexplore-ieee-org.proxy-ub.rug.nl/document/840995,1999,ICSE
"A Liberal Theory of Social Welfare: Fairness, Utility, and the Pareto Principle",https://www.researchgate.net/publication/228256839_A_Liberal_Theory_of_Social_Welfare_Fairness_Utility_and_the_Pareto_Principle,2000,The Yale Law Journal
A classification and comparison framework for software architecture description languages,https://ieeexplore-ieee-org.proxy-ub.rug.nl/document/825767,2000,IEEE Transactions on Software Engineering
ACDC: An Algorithm for Comprehension-Driven Clustering,https://ieeexplore-ieee-org.proxy-ub.rug.nl/stamp/stamp.jsp?arnumber=891477,2000,WCRE
Domain-Specific Application Frameworks,https://books.google.nl/books/about/Domain_Specific_Application_Frameworks.html?id=3YIpAQAAMAAJ&redir_esc=y,2000,Book
Pattern-Oriented Software Architecture: Patterns for Concurrent and Networked Objects,https://www.researchgate.net/publication/215835789_Pattern-Oriented_Software_Architecture_Patterns_for_Concurrent_and_Networked_Objects_Volume_2,2000,Book
Design Rules Volume I: The Power of Modularity,https://www.researchgate.net/publication/227458384_Design_Rules_Volume_I_The_Power_of_Modularity,2000,Book
Predicting fault incidence using software change history,https://ieeexplore-ieee-org.proxy-ub.rug.nl/document/859533,2000,IEEE Transactions on Software Engineering
Exploring the relationships between design measures and software quality in object-oriented systems,https://www.researchgate.net/publication/222547352_Exploring_the_relationships_between_design_measures_and_software_quality_in_object-oriented_systems,2000,Journal of Systems and Software
Software profiling for hot path prediction: less is more,https://dl-acm-org.proxy-ub.rug.nl/doi/10.1145/356989.357008,2000,ACM SIGPLAN Notices
Effective synchronization removal for Java,https://dl-acm-org.proxy-ub.rug.nl/doi/10.1145/349299.349327,2000,PLDI
A Coupling-Guided Cluster Analysis Approach to Reengineer the Modularity of Object-Oriented Systems,https://dl-acm-org.proxy-ub.rug.nl/doi/10.5555/518900.795263,2000,CSMR
