Paper Name,Link,Year,Venue
"Hands-On RESTful API Design Patterns and Best Practices: Design, develop, and deploy highly adaptable, scalable, and secure RESTful web APIs",https://www.amazon.nl/Hands-RESTful-Design-Patterns-Practices/dp/1788992660,2019,Book
A Demand-Side Viewpoint to Software Vulnerabilities in WordPress Plugins,https://dl-acm-org.proxy-ub.rug.nl/doi/10.1145/3319008.3319029,2019,EASE
Data-Driven Selection of Security Application Frameworks During Architectural Design,https://scholarspace.manoa.hawaii.edu/items/5a03fc55-07c7-403e-b116-41553799f150,2019,Hawaii International Conference on System Sciences
An Empirical Study on API Usages,https://ieeexplore-ieee-org.proxy-ub.rug.nl/document/8186224,2019,IEEE Transactions on Software Engineering
CodeKernel: A Graph Kernel Based Approach to the Selection of API Usage Examples,https://ieeexplore-ieee-org.proxy-ub.rug.nl/document/8952546,2019,ASE
A Systematic Evaluation of Static API-Misuse Detectors,https://ieeexplore-ieee-org.proxy-ub.rug.nl/document/8338426,2019,IEEE Transactions on Software Engineering
HiRec: API Recommendation using Hierarchical Context,https://ieeexplore-ieee-org.proxy-ub.rug.nl/document/8987517,2019,ISSRE
Mining Scala Framework Extensions for Recommendation Patterns,https://ieeexplore-ieee-org.proxy-ub.rug.nl/document/8668019,2019,SANER
Automatic Examining of Software Architectures on Mobile Applications Codebases,https://ieeexplore-ieee-org.proxy-ub.rug.nl/document/8919153,2019,ICSME
Analyzing Software Architecture Evolvability Based on Multiple Architectural Attributes Measurements,https://ieeexplore-ieee-org.proxy-ub.rug.nl/document/8854729,2019,QRS
Recover and RELAX: Concern-Oriented Software Architecture Recovery for Systems Development and Maintenance,https://ieeexplore-ieee-org.proxy-ub.rug.nl/document/8812871,2019,ICSSP
An Empirical Study of Cohesion and Coupling: Balancing Optimization and Disruption,https://ieeexplore-ieee-org.proxy-ub.rug.nl/document/7892940,2019,IEEE Transactions on Evolutionary Computation
Anticipatory development processes for reducing total ownership costs and schedules,https://onlinelibrary-wiley-com.proxy-ub.rug.nl/doi/10.1002/sys.21490,2019,Systems Engineering
On the Alternatives for Composing Batch Refactoring,https://ieeexplore-ieee-org.proxy-ub.rug.nl/document/8844411,2019,IWoR
Do Research and Practice of Code Smell Identification Walk Together? A Social Representations Analysis,https://ieeexplore-ieee-org.proxy-ub.rug.nl/document/8870141,2019,ESEM
"""Bad smells"" in software analytics papers",https://www-sciencedirect-com.proxy-ub.rug.nl/science/article/pii/S095058491930076X,2019,Information and Software Technology
Rebasing in Code Review Considered Harmful: A Large-Scale Empirical Investigation,https://ieeexplore-ieee-org.proxy-ub.rug.nl/document/8930883,2019,SCAM
A Comprehensive Investigation of the Role of Imbalanced Learning for Software Defect Prediction,https://ieeexplore-ieee-org.proxy-ub.rug.nl/document/8359087,2019,IEEE Transactions on Software Engineering
"Automated Machine Learning: Methods, Systems, Challenges",https://www.amazon.nl/Automated-Machine-Learning-Methods-Challenges/dp/3030053172,2019,Book
Machine Learning Techniques for Code Smells Detection: A Systematic Mapping Study,https://www-worldscientific-com.proxy-ub.rug.nl/doi/abs/10.1142/S021819401950013X,2019,International Journal of Software Engineering and Knowledge Engineering
Machine Learning techniques for code smell detection: A systematic literature review and meta-analysis,https://www-sciencedirect-com.proxy-ub.rug.nl/science/article/pii/S0950584918302623?via%3Dihub,2019,Information and Software Technology
Toward Proactive Refactoring: An Exploratory Study on Decaying Modules,https://ieeexplore-ieee-org.proxy-ub.rug.nl/document/8844415,2019,IWoR
Can Automated Impact Analysis Techniques Help Predict Decaying Modules?,https://ieeexplore-ieee-org.proxy-ub.rug.nl/document/8919044,2019,ICSME
A survey of many-objective optimisation in search-based software engineering,https://www-sciencedirect-com.proxy-ub.rug.nl/science/article/pii/S0164121218302759,2019,Journal of Systems and Software
Analysis of the Criteria Adopted in Industry to Extract Microservices,https://ieeexplore-ieee-org.proxy-ub.rug.nl/document/8836155,2019,CESI/SER&IP
Automated Characterization of Software Vulnerabilities,https://ieeexplore-ieee-org.proxy-ub.rug.nl/document/8918946,2019,ICSME
How do empirical software engineering researchers assess the credibility of practitioner-generated blog posts?,https://doi.org/10.1145/3319008.3319013,2019,10.1145/3319008.3319013
BERT: Pre-training of Deep Bidirectional Transformers for Language Understanding,http://arxiv.org/abs/1810.04805,2019,10.48550/arXiv.1810.04805
RoBERTa: A Robustly Optimized BERT Pretraining Approach,http://arxiv.org/abs/1907.11692,2019,10.48550/arXiv.1907.11692
Improving the Consistency and Usefulness of Architecture Descriptions: Guidelines for Architects,https://ieeexplore.ieee.org/abstract/document/8703919,2019,10.1109/ICSA.2019.00024
Towards Consistency Checking Between Software Architecture and Informal Documentation,https://ieeexplore.ieee.org/abstract/document/8712160,2019,10.1109/ICSA-C.2019.00052
Semi-automatic mapping of source code using naive Bayes,https://doi.org/10.1145/3344948.3344984,2019,10.1145/3344948.3344984
Process-mining based dynamic software architecture reconstruction,https://doi.org/10.1145/3344948.3344985,2019,10.1145/3344948.3344985
Source-code divergence diagnosis using constraints and cryptography,https://doi.org/10.1145/3344948.3344983,2019,10.1145/3344948.3344983
"Component Comparison, Evaluation, and Selection: A Continuous Approach",https://ieeexplore.ieee.org/abstract/document/8712345,2019,10.1109/ICSA-C.2019.00023
Detection and Repair of Architectural Inconsistencies in Java,https://ieeexplore-ieee-org.proxy-ub.rug.nl/document/8812079,2019,ICSE
Investigating the Impact of Multiple Dependency Structures on Software Defects,https://ieeexplore-ieee-org.proxy-ub.rug.nl/document/8812092,2019,ICSE
FOCUS: A Recommender System for Mining API Function Calls and Usage Patterns,https://ieeexplore-ieee-org.proxy-ub.rug.nl/document/8812051,2019,ICSE
An Empirical Investigation on the Relationship between Design and Architecture Smells,https://www.researchgate.net/publication/342830617_An_Empirical_Investigation_on_the_Relationship_between_Design_and_Architecture_Smells,2020,Empirical Software Engineering
A systematic mapping study on architectural smells detection,https://www.researchgate.net/publication/347419232_A_systematic_mapping_study_on_architectural_smells_detection,2020,Journal of Systems and Software
An Empirical Study of Software Exceptions in the Field using Search Logs,https://arxiv.org/pdf/2006.00385.pdf,2020,ESEM
Robotics Multi-Annual Roadmap For Robotics in Europe,https://www.eu-robotics.net/cms/upload/downloads/ppp-documents/Multi-Annual_Roadmap2020_ICT-24_Rev_B_full.pdf,2020,Book
Energy Efficiency in Robotics Software: A Systematic Literature Review,https://ieeexplore-ieee-org.proxy-ub.rug.nl/abstract/document/9319310,2020,ASEW
Cross-Dataset Design Discussion Mining,https://www.researchgate.net/publication/338421230_Cross-Dataset_Design_Discussion_Mining,2020,SANER
Improving Software Architecture Design Decision by Selecting Set of Solutions,https://ieeexplore-ieee-org.proxy-ub.rug.nl/abstract/document/9073818,2020,iCoMET
Estimating the Complexity of Architectural Design Decision Networks,https://ieeexplore-ieee-org.proxy-ub.rug.nl/document/9194700,2020,IEEE Access
Identifying Semantic Outliers of Source Code Artifacts and Their Application to Software Architecture Recovery,https://ieeexplore-ieee-org.proxy-ub.rug.nl/document/9269345,2020,IEEE Access
On the relationship between design discussions and design quality: a case study of Apache projects,https://dl-acm-org.proxy-ub.rug.nl/doi/10.1145/3368089.3409707,2020,ESEC/FSE
An Empirical Study of Architectural Changes in Code Commits,https://dl-acm-org.proxy-ub.rug.nl/doi/10.1145/3457913.3457924,2020,Internetware
Automatic Identification of Decisions from the Hibernate Developer Mailing List,https://dl-acm-org.proxy-ub.rug.nl/doi/10.1145/3383219.3383225,2020,EASE
Recording Software Design Decisions on the Fly,https://www.researchgate.net/publication/351899798_Recording_Software_Design_Decisions_on_the_Fly,2020,SEED & NLPaSE
What Matterns to Students - A Rationale Management Case Study in Agile Software Development,https://www.researchgate.net/publication/338533856_What_Matters_to_Students_-_A_Rationale_Management_Case_Study_in_Agile_Software_Development,2020,Software Engineering im Unterricht der Hochschulen
Requirements knowledge acquisition from online user forums,https://www.researchgate.net/publication/338992629_Requirements_knowledge_acquisition_from_online_user_forums,2020,IET Software
Would You Lie To Me Bot? Supporting Decision-Making Processes with Deceiving Virtual Agents,https://www.researchgate.net/publication/345759653_Would_You_Lie_To_Me_Bot_Supporting_Decision-Making_Processes_with_Deceiving_Virtual_Agents,2020,Procedia Computer Science
Tool support for architectural decision making in large software intensive projects,https://www.researchgate.net/publication/341251773_Tool_support_for_architectural_decision_making_in_large_software_intensive_projects,2020,Thesis
"Conceptualizing, extracting and analysing requirements arguments in users' forums: The CrowdRE-Arg framework",https://dl-acm-org.proxy-ub.rug.nl/doi/abs/10.1002/smr.2309,2020,Journal of Software: Evolution and Process
Sen4Smells: A Tool for Ranking Sensitive Smells for an Architecture Debt Index,https://ieeexplore-ieee-org.proxy-ub.rug.nl/document/9505535,2020,ARGENCON
Integrated Formal Tools for Software Architecture Smell Detection,https://www.researchgate.net/publication/343311474_Integrated_Formal_Tools_for_Software_Architecture_Smell_Detection,2020,International Journal of Software Engineering and Knowledge Engineering
Capturing software architecture knowledge for pattern-driven design,https://www.researchgate.net/publication/342660374_Capturing_software_architecture_knowledge_for_pattern-driven_design,2020,Journal of Systems and Software
Harmony Search-Based Approach for Multi-Objective Software Architecture Reconstruction,https://www.researchgate.net/publication/346499356_Harmony_Search-Based_Approach_for_Multi-Objective_Software_Architecture_Reconstruction,2020,Article
On Data Analysis of Software Repositories,https://www.researchgate.net/publication/338961484_On_Data_Analysis_of_Software_Repositories,2020,Chapter
Software Architecture Framework of Healthcare Using Nonfunctional Artifacts,https://www.researchgate.net/publication/339674127_Software_Architecture_Framework_of_Healthcare_Using_Nonfunctional_Artifacts,2020,Chapter
Relationships between design problem agglomerations and concerns having types and domains of software and transverse dimensions,https://www.researchgate.net/publication/342692422_Relationships_between_design_problem_agglomerations_and_concerns_having_types_and_domains_of_software_as_transverse_dimensions,2020,Journal of the Brazilian Computer Society
Examining the Relationship of Code and Architectural Smells with Software Vulnerabilities,https://arxiv.org/abs/2010.15978,2020,APSEC
"""The Canary in the Coal Mine..."" A cautionary tale from the decline of SourceForge",https://www.researchgate.net/publication/342952764_The_Canary_in_the_Coal_Mine_A_cautionary_tale_from_the_decline_of_SourceForge,2020,Software Practice and Experience
Detecting architectural integrity violation patterns using machine learning,https://dl-acm-org.proxy-ub.rug.nl/doi/10.1145/3341105.3374008,2020,SAC
Towards an Automated Approach for Detecting Architectural Weaknesses in Critical Systems,https://dl-acm-org.proxy-ub.rug.nl/doi/10.1145/3387940.3392222,2020,ICSEW
Software Security Specifications and Design: How Software Engineers and Practitioners Are Mixing Things up,https://dl-acm-org.proxy-ub.rug.nl/doi/10.1145/3383219.3383284,2020,EASE
inSet: A Tool to Identify Architecture Smells Using Machine Learning,https://dl-acm-org.proxy-ub.rug.nl/doi/10.1145/3422392.3422507,2020,SBES
"Internal Software Quality Evaluation of Self-adaptive Systems Using Metrics, Patterns, and Smells",https://link-springer-com.proxy-ub.rug.nl/chapter/10.1007/978-3-030-70006-5_16,2020,ENASE
A Systematic Review of Load Balancing Techniques in Software-Defined Networking,https://ieeexplore-ieee-org.proxy-ub.rug.nl/document/9097181,2020,IEEE Access
MockRest--A Generic Approach for Automated Mock Framework for REST APIs Generation,https://link-springer-com.proxy-ub.rug.nl/chapter/10.1007/978-981-15-0146-3_24,2020,Inventive Communication and Computatinal Technologies
Microservice transition and its granularity problem; A systematic mapping study,https://onlinelibrary-wiley-com.proxy-ub.rug.nl/doi/10.1002/spe.2869,2020,Software: Practice and Experience
Navigational Support for Non HATEOAS-Compliant Web-Based APIs,https://link-springer-com.proxy-ub.rug.nl/chapter/10.1007/978-3-030-64846-6_10,2020,SummerSOC
Evolution in dynamic software product lines,https://onlinelibrary-wiley-com.proxy-ub.rug.nl/doi/10.1002/smr.2293,2020,Journal of Software: Evolution and Process
Mining Important Functions in Software Network by Node Vulnerability,https://iopscience-iop-org.proxy-ub.rug.nl/article/10.1088/1742-6596/1453/1/012015,2020,Journal of Physics: Conference Series
Metrics for Assessing Architecture Conformance to Microservice Architecture Patterns and Practices,https://link-springer-com.proxy-ub.rug.nl/chapter/10.1007/978-3-030-65310-1_42,2020,ICSOC
Essential Sentences for Navigating Stack Overflow Answers,https://ieeexplore-ieee-org.proxy-ub.rug.nl/document/9054828,2020,SANER
Using Stack Overflow to Assess Technical Debt Identification on Software Projects,https://dl-acm-org.proxy-ub.rug.nl/doi/10.1145/3422392.3422429,2020,SBES
DINA: Detecting Hidden Android Inter-App Communication in Dynamic Loaded Code,https://ieeexplore-ieee-org.proxy-ub.rug.nl/document/9017933,2020,IEEE Transactions on Information Forensics and Security
Privacy Analysis of COVID-19 Contact Tracing Apps in the EU,https://link-springer-com.proxy-ub.rug.nl/chapter/10.1007/978-3-030-70852-8_13,2020,NordSec
Exploring the Architectural Impact of Possible Dependencies in Python Software,https://ieeexplore-ieee-org.proxy-ub.rug.nl/document/9286085,2020,ASE
When Are Smells Indicators of Architectural Refactoring Opportunities: A Study of 50 Software Projects,https://dl-acm-org.proxy-ub.rug.nl/doi/10.1145/3387904.3389276,2020,ICPC
Exploring software bug-proneness based on evolutionary clique modeling and analysis,https://www-sciencedirect-com.proxy-ub.rug.nl/science/article/pii/S0950584920301476?via%3Dihub,2020,Information and Software Technology
A case study on modularity violations in cyber-physical systems,https://onlinelibrary-wiley-com.proxy-ub.rug.nl/doi/10.1002/sys.21530,2020,Systems Engineering
"ARCADE: an extensible workbench for architecture recovery, change, and decay evaluation",https://dl-acm-org.proxy-ub.rug.nl/doi/10.1145/3368089.3417941,2020,ESEC/FSE
Towards a Knowledge Condensation Tool to Capture Expertise,https://link-springer-com.proxy-ub.rug.nl/chapter/10.1007/978-3-030-63329-5_11,2020,CIMPS
Organising the knowledge from stack overflow about location-sensing of Android applications,https://ietresearch-onlinelibrary-wiley-com.proxy-ub.rug.nl/doi/10.1049/iet-sen.2019.0284,2020,IET Software
Message from the Chairs,https://ieeexplore-ieee-org.proxy-ub.rug.nl/document/9319301,2020,ASEW
Metrics in automotive software development: A systematic literature review,https://onlinelibrary-wiley-com.proxy-ub.rug.nl/doi/10.1002/smr.2296,2020,Journal of Software: Evolution and Process
Coding Overhead of Mobile Apps,https://ieeexplore-ieee-org.proxy-ub.rug.nl/document/9458165,2020,CSCI
A Smartphone Application Designed to Detect Obstacles for Pedestrians' Safety,https://link-springer-com.proxy-ub.rug.nl/chapter/10.1007/978-3-030-76063-2_25,2020,Chapter
Understanding Software Security from Design to Deployment,https://dl-acm-org.proxy-ub.rug.nl/doi/abs/10.1145/3385678.3385687,2020,ACM SIGSOFT Software Engineering Notes
Towards assisting developers in API usage by automated recovery of complex temporal patterns,https://www-sciencedirect-com.proxy-ub.rug.nl/science/article/pii/S0950584918301642?via%3Dihub,2020,Information and Software Technology
Exploration on Theoretical and Practical Projects of Software Architecture Course,https://ieeexplore-ieee-org.proxy-ub.rug.nl/document/9201748,2020,ICCSE
Restructuring Object-Oriented Software Systems Using Various Aspects of Class Information,https://link-springer-com.proxy-ub.rug.nl/article/10.1007/s13369-020-04785-z,2020,Arabian Journal for Science and Engineering
A preliminary analysis of self-adaptive systems according to different issues,https://link-springer-com.proxy-ub.rug.nl/article/10.1007/s11219-020-09502-5,2020,Software Quality Journal
How Does Modern Code Review Impact Software Design Degradation? An In-depth Empirical Study,https://ieeexplore-ieee-org.proxy-ub.rug.nl/document/9240657,2020,ICSME
On the EffecCode Reviews on Code Smells,https://www-semanticscholar-org.proxy-ub.rug.nl/paper/On-The-Effect-Of-Code-Review-On-Code-Smells-Pascarella-Spadini/315aad471f73bbc0186ae5b2c15dad941321d311,2020,SANER
Revealing the Social Aspects of Design Decay: A Retrospective Study of Pull Requests,https://dl-acm-org.proxy-ub.rug.nl/doi/10.1145/3422392.3422443,2020,SBES
Are Code Smell Co-occurences Harmful to Internal Quality Attributes?: A Mixed-Method Study,https://dl-acm-org.proxy-ub.rug.nl/doi/10.1145/3422392.3422419,2020,SBES
Sampling Effect on Performance Prediction of Configurable Systems: A Case Study,https://dl-acm-org.proxy-ub.rug.nl/doi/10.1145/3358960.3379137,2020,ICPE
"On the Relation between Complexity, Explicitness, Effectiveness of Refactorings and Non-Functional Concerns",https://dl-acm-org.proxy-ub.rug.nl/doi/10.1145/3422392.3422439,2020,SBES
Knowledge Transfer in Modern Code Review,https://dl-acm-org.proxy-ub.rug.nl/doi/10.1145/3387904.3389270,2020,ICPC
A large-scale comparative analysis of Coding Standard conformance in Open-Source Data Science projects,https://dl-acm-org.proxy-ub.rug.nl/doi/10.1145/3382494.3410680,2020,ESEM
Standing on shoulders or feet? An extended study on the usage of the MSR data papers,https://link-springer-com.proxy-ub.rug.nl/article/10.1007/s10664-020-09834-7,2020,Empirical Software Engineering
Learning Embeddings of Directed Networks with Text-Associated Nodes--with Application in Software Package Dependency Networks,https://ieeexplore-ieee-org.proxy-ub.rug.nl/document/9377817,2020,Big Data
Improving bug report triage performance using artificial intelligence based document generation model,https://link-springer-com.proxy-ub.rug.nl/article/10.1186/s13673-020-00229-7,2020,Human-centric Computing and Information Sciences
Built-In Cybersecurity: Insights Into Product Security for Cyberphysical Systems at a Large Company,https://ieeexplore-ieee-org.proxy-ub.rug.nl/document/9186433,2020,IEEE Security & Privacy
Automating the early detection of security design flaws,https://dl-acm-org.proxy-ub.rug.nl/doi/10.1145/3365438.3410954,2020,MODELS
"Learning from Vulnerabilities - Categorising, Understanding and Detecting Weaknesses in Industrial Control Systems",https://link-springer-com.proxy-ub.rug.nl/chapter/10.1007/978-3-030-64330-0_7,2020,CyberICPS/SECPRE/ADIoT
Automatic Identification of Decisions from the Hibernate Developer Mailing List,https://doi.org/10.1145/3383219.3383225,2020,10.1145/3383219.3383225
CodeBERT: A Pre-Trained Model for Programming and Natural Languages,http://arxiv.org/abs/2002.08155,2020,10.48550/arXiv.2002.08155
Automatic Detection and Repair Recommendation of Directive Defects in Java API Documentation,https://ieeexplore.ieee.org/abstract/document/8478004,2020,10.1109/TSE.2018.2872971
Towards Detecting Inconsistent Comments in Java Source Code Automatically,https://ieeexplore.ieee.org/abstract/document/9252010,2020,10.1109/SCAM51674.2020.00012
Towards Detecting Inconsistent Comments in Java Source Code Automatically,https://ieeexplore.ieee.org/abstract/document/9252010,2020,10.1109/SCAM51674.2020.00012
LUKE: Deep Contextualized Entity Representations with Entity-aware Self-attention,http://arxiv.org/abs/2010.01057,2020,10.48550/arXiv.2010.01057
Explainable Recommendation: A Survey and New Perspectives,https://www.nowpublishers.com/article/Details/INR-066,2020,10.1561/1500000066
The forgotten case of the dependency bugs: on the example of the robot operating system,https://dl-acm-org.proxy-ub.rug.nl/doi/10.1145/3377813.3381364,2020,ICSE
How do you Architect your Robots? State of the Practice and Guidelines for the ROS-based Systems,https://ieeexplore-ieee-org.proxy-ub.rug.nl/document/9276566,2020,ICSE
"Demystify Official API Usage Directives with Crowdsourced API Misuse Scenarios, Erroneous Code Examples and Patches",https://ieeexplore-ieee-org.proxy-ub.rug.nl/document/9283947,2020,ICSE
Planning for Untangling: Predicting the Difficulty of Merge Conflicts,https://ieeexplore-ieee-org.proxy-ub.rug.nl/document/9284005,2020,ICSE
Automatically generating taxonomy for grouping app reviews - a study of three apps,https://www.researchgate.net/publication/355755232_Automatically_generating_taxonomy_for_grouping_app_reviews_-_a_study_of_three_apps,2021,Software Quality Journal
Will Data Influence the Experiment Results?: A Replication Study of Automatic Identification of Decisions,https://ieeexplore-ieee-org.proxy-ub.rug.nl/document/9426010,2021,SANER
Locating Latent Desing Information in Developer Discussions: A Study on Pull Requests,https://ieeexplore-ieee-org.proxy-ub.rug.nl/document/8742578,2021,IEEE Transactions on Software Engineering
Semantic Slicing of Architectural Change Commits: Towards Semantic Design Review,https://dl-acm-org.proxy-ub.rug.nl/doi/10.1145/3475716.3484487,2021,ESEM
A Machine Learning Based Ensemble Method for Automatic Multiclass Classification of Decisions,https://dl-acm-org.proxy-ub.rug.nl/doi/10.1145/3463274.3463325,2021,EASE
Architecture violations detection and visualization in the continuous integration pipeline,https://onlinelibrary-wiley-com.proxy-ub.rug.nl/doi/10.1002/spe.3004,2021,Article
Exploring Web Search Engines to Find Architectural Knowledge,https://www.researchgate.net/publication/350311166_Exploring_Web_Search_Engines_to_Find_Architectural_Knowledge,2021,Article
Automated Identification of Security Discussions in Microservices Systems: Industrial Surveys and Experiments,https://www.researchgate.net/publication/353257772_Automated_Identification_of_Security_Discussions_in_Microservices_Systems_Industrial_Surveys_and_Experiments,2021,Journal of Systems and Software
Architectural design decisions that incur technical debt - An industrial case study,https://www.researchgate.net/publication/352379166_Architectural_design_decisions_that_incur_technical_debt_-_An_industrial_case_study,2021,Information and Software Technology
Mining guidelines for architecting robotics software,https://www-sciencedirect-com.proxy-ub.rug.nl/science/article/pii/S0164121221000662,2021,Journal of Systems and Software
Decision-Making Under Uncertainty for the Deployment of Future Hyperconnected Networks: A Survey,https://www.researchgate.net/publication/351994423_Decision-Making_Under_Uncertainty_for_the_Deployment_of_Future_Hyperconnected_Networks_A_Survey,2021,Sensors
Custom-MADE - Leveraging Agile Rationale Management by Employing Domain-Specific Languages,https://www.researchgate.net/publication/352322583_Custom-MADE_-_Leveraging_Agile_Rationale_Management_by_Employing_Domain-Specific_Languages,2021,EWSC
Underproduction: An Approach for Measuring Risk in Open Source Software,https://www.researchgate.net/publication/349703866_Underproduction_An_Approach_for_Measuring_Risk_in_Open_Source_Software,2021,SANER
Architectural Archipelagos: Technical Debt in Long-Lived Software Research Platforms,https://ieeexplore-ieee-org.proxy-ub.rug.nl/document/9462988,2021,TechDebt
Understanding Architecture Erosion: The Practitioners' Perspective,https://ieeexplore-ieee-org.proxy-ub.rug.nl/document/9463012,2021,ICPC
"An Empirical Study on Underlying Correlations between Runtime Performance Deficiencies and ""Bad Smells"" of Microservice Systems",https://www-computer-org.proxy-ub.rug.nl/csdl/proceedings-article/icws/2021/168100a751/1yrHHOepNcY,2021,ICWS
Exploring the Relation Between Co-changes and Architectural Smells,https://www.researchgate.net/publication/347409666_Exploring_the_Relation_Between_Co-changes_and_Architectural_Smells,2021,SN Computer Science
On the relation between architectural smells and source code changes,https://dl-acm-org.proxy-ub.rug.nl/doi/abs/10.1002/smr.2398,2021,Journal of Software: Evolution and Process
AC²: towards understanding architectural changes in Python projects,https://dl-acm-org.proxy-ub.rug.nl/doi/10.1145/3468264.3473120,2021,ESEC/FSE
Evaluating and Improving Microservice Architecture Conformance to Architectural Design Decisions,https://link-springer-com.proxy-ub.rug.nl/chapter/10.1007/978-3-030-91431-8_12,2021,ICSOC
What Software Architecture Styles are Popular?,https://www.researchgate.net/publication/354005766_What_Software_Architecture_Styles_are_Popular,2021,Proceedings of the Institute for System Programming of RAS
Towards Automated Threat Modeling of Cyber-Physical Systems,https://ieeexplore-ieee-org.proxy-ub.rug.nl/document/9537068,2021,ICSECS-ICOCSIM
