Paper Name,Link,Year,Venue
Improving Agile Planning for Reliable Software Delivery,https://www.computer.org/csdl/proceedings-article/msr/2023/118400a025/1OIL4tvzSTu,2023,MSR
Characterizing and Understanding Software Security Vulnerabilities in Machine Learning Libraries,https://www.computer.org/csdl/proceedings-article/msr/2023/118400a027/1OIL5dnMAdW,2023,MSR
AutoML from Software Engineering Perspective: Landscapes and Challenges,https://www.computer.org/csdl/proceedings-article/msr/2023/118400a039/1OIKXNqvTsk,2023,MSR
DeepScenario: An Open Driving Scenario Dataset for Autonomous Driving System Testing,https://www.computer.org/csdl/proceedings-article/msr/2023/118400a052/1OIKVZJmd4k,2023,MSR
PTMTorrent: A Dataset for Mining Open-source Pre-trained Model Packages,https://www.computer.org/csdl/proceedings-article/msr/2023/118400a057/1OIKWZ6GGPe,2023,MSR
NICHE: A Curated Dataset of Engineered Machine Learning Projects in Python,https://www.computer.org/csdl/proceedings-article/msr/2023/118400a062/1OIL57pVfJS,2023,MSR
Evaluating Software Documentation Quality,https://www.computer.org/csdl/proceedings-article/msr/2023/118400a067/1OIKZbvehXi,2023,MSR
What Do Users Ask in Open-Source AI Repositories? An Empirical Study of GitHub Issues,https://www.computer.org/csdl/proceedings-article/msr/2023/118400a079/1OIKWH0ClEc,2023,MSR
Picaso: Enhancing API Recommendations with Relevant Stack Overflow Posts,https://www.computer.org/csdl/proceedings-article/msr/2023/118400a092/1OIL4nVQssU,2023,MSR
GIRT-Data: Sampling GitHub Issue Report Templates,https://www.computer.org/csdl/proceedings-article/msr/2023/118400a104/1OIKZ5ikdzO,2023,MSR
TypeScripts Evolution: An Analysis of Feature Adoption Over Time,https://www.computer.org/csdl/proceedings-article/msr/2023/118400a109/1OIL3LQtroc,2023,MSR
"DGMF: Fast Generation of Comparable, Updatable Dependency Graphs for Software Repositories",https://www.computer.org/csdl/proceedings-article/msr/2023/118400a115/1OIKXpxmYJG,2023,MSR
Enabling Analysis and Reasoning on Software Systems through Knowledge Graph Representation,https://www.computer.org/csdl/proceedings-article/msr/2023/118400a120/1OIL2Dv4LOU,2023,MSR
microSecEnD: A Dataset of Security-Enriched Dataflow Diagrams for Microservice Applications,https://www.computer.org/csdl/proceedings-article/msr/2023/118400a125/1OIKWMLZkpq,2023,MSR
Wasmizer: Curating WebAssembly-driven Projects on GitHub,https://www.computer.org/csdl/proceedings-article/msr/2023/118400a130/1OIKYda39AY,2023,MSR
Feature Toggle Usage Patterns: A Case Study on Google Chromium,https://www.computer.org/csdl/proceedings-article/msr/2023/118400a142/1OIKZWvPvxK,2023,MSR
On Codex Prompt Engineering for OCL Generation: An Empirical Study,https://www.computer.org/csdl/proceedings-article/msr/2023/118400a148/1OIL44J5bOg,2023,MSR
Cross-Domain Evaluation of a Deep Learning-Based Type Inference System,https://www.computer.org/csdl/proceedings-article/msr/2023/118400a158/1OIL21ReQms,2023,MSR
Enriching Source Code with Contextual Data for Code Completion Models: An Empirical Study,https://www.computer.org/csdl/proceedings-article/msr/2023/118400a170/1OIL5uDCJt6,2023,MSR
Model-Agnostic Syntactical Information for Pre-Trained Programming Language Models,https://www.computer.org/csdl/proceedings-article/msr/2023/118400a183/1OIL3XBYxG0,2023,MSR
An Empirical Study of High Performance Computing (HPC) Performance Bugs,https://www.computer.org/csdl/proceedings-article/msr/2023/118400a194/1OIKVMBPQhq,2023,MSR
What Happens When We Fuzz? Investigating OSS-Fuzz Bug History,https://www.computer.org/csdl/proceedings-article/msr/2023/118400a207/1OIL51PCD3a,2023,MSR
Semantically-enriched Jira Issue Tracking Data,https://www.computer.org/csdl/proceedings-article/msr/2023/118400a218/1OIL0f408Ba,2023,MSR
HasBugs - Handpicked Haskell Bugs,https://www.computer.org/csdl/proceedings-article/msr/2023/118400a223/1OIKXgtUps4,2023,MSR
An Empirical Study on the Performance of Individual Issue Label Prediction,https://www.computer.org/csdl/proceedings-article/msr/2023/118400a228/1OIKWrE0x7G,2023,MSR
Investigating the Resolution of Vulnerable Dependencies with Dependabot Security Updates,https://www.computer.org/csdl/proceedings-article/msr/2023/118400a234/1OIKYryu0xO,2023,MSR
Unveiling the Relationship Between Continuous Integration and Code Coverage,https://www.computer.org/csdl/proceedings-article/msr/2023/118400a247/1OIKXvHIEWA,2023,MSR
EGAD: A moldable tool for GitHub Action analysis,https://www.computer.org/csdl/proceedings-article/msr/2023/118400a260/1OIKY4xQ4Ny,2023,MSR
"The Atlassian Data Lake: consolidating enriched software development data in a single, queryable system",https://www.computer.org/csdl/proceedings-article/msr/2023/118400a265/1OIKXaLnpZu,2023,MSR
Are We Speeding Up or Slowing Down? On Temporal Aspects of Code Velocity,https://www.computer.org/csdl/proceedings-article/msr/2023/118400a267/1OIKWT4hMg8,2023,MSR
Energy Consumption Estimation of API-usage in Smartphone Apps via Static Analysis,https://www.computer.org/csdl/proceedings-article/msr/2023/118400a272/1OIL0ATYL2U,2023,MSR
Do Subjectivity and Objectivity Always Agree A Case Study with Stack Overflow Questions,https://www.computer.org/csdl/proceedings-article/msr/2023/118400a389/1OIL09gDXVu,2023,MSR
GiveMeLabeledIssues: An Open Source Issue Recommendation System,https://www.computer.org/csdl/proceedings-article/msr/2023/118400a402/1OIKYDZZK5a,2023,MSR
DocMine: A Software Documentation-Related Dataset of 950 GitHub Repositories,https://www.computer.org/csdl/proceedings-article/msr/2023/118400a407/1OIL5p5jiGQ,2023,MSR
"PENTACET data - 23 Million Contextual Code Comments and 250,000 SATD comments",https://www.computer.org/csdl/proceedings-article/msr/2023/118400a412/1OIL1uhsIpi,2023,MSR
Dont Forget the Exception! : Considering Robustness Changes to Identify Design Problems,https://www.computer.org/csdl/proceedings-article/msr/2023/118400a417/1OIL2PNMWkg,2023,MSR
Pre-trained Model Based Feature Envy Detection,https://www.computer.org/csdl/proceedings-article/msr/2023/118400a430/1OIL104SXjG,2023,MSR
An Exploratory Study on Energy Consumption of Dataframe Processing Libraries,https://www.computer.org/csdl/proceedings-article/msr/2023/118400a284/1OIL0N4K9Us,2023,MSR
Whistleblowing and Tech on Twitter,https://www.computer.org/csdl/proceedings-article/msr/2023/118400a296/1OIL4yVWy1W,2023,MSR
UnGoML: Automated Classification of unsafe Usages in Go,https://www.computer.org/csdl/proceedings-article/msr/2023/118400a309/1OIKVCGJ5pC,2023,MSR
Connecting the .dotfiles: Checked-In Secret Exposure with Extra (Lateral Movement) Steps,https://www.computer.org/csdl/proceedings-article/msr/2023/118400a322/1OIL3zTTZ1S,2023,MSR
MANDO-HGT: Heterogeneous Graph Transformers for Smart Contract Vulnerability Detection,https://www.computer.org/csdl/proceedings-article/msr/2023/118400a334/1OIL1VeMSha,2023,MSR
SecretBench: A Dataset of Software Secrets,https://www.computer.org/csdl/proceedings-article/msr/2023/118400a347/1OIL2xdlwek,2023,MSR
An Empirical Study to Investigate Collaboration Among Developers in Open Source Software (OSS),https://www.computer.org/csdl/proceedings-article/msr/2023/118400a352/1OIL02UEJnW,2023,MSR
Insights into Female Contributions in Open-Source Projects,https://www.computer.org/csdl/proceedings-article/msr/2023/118400a357/1OIL0r7Xala,2023,MSR
The Secret Life of CVEs,https://www.computer.org/csdl/proceedings-article/msr/2023/118400a362/1OIKZibEDRu,2023,MSR
Evolution of the Practice of Software Testing in Java Projects,https://www.computer.org/csdl/proceedings-article/msr/2023/118400a367/1OIL1HAUeEU,2023,MSR
Keep the Ball Rolling: Analyzing Release Cadence in GitHub Projects,https://www.computer.org/csdl/proceedings-article/msr/2023/118400a372/1OIL2JqFjgs,2023,MSR
Understanding the Role of Images on Stack Overflow,https://www.computer.org/csdl/proceedings-article/msr/2023/118400a377/1OIKVTEGvsI,2023,MSR
CLEAN++: Code Smells Extraction for C++,https://www.computer.org/csdl/proceedings-article/msr/2023/118400a441/1OIKXBDSoEg,2023,MSR
DACOSA Manually Annotated Dataset of Code Smells,https://www.computer.org/csdl/proceedings-article/msr/2023/118400a446/1OIKX5381EY,2023,MSR
What Warnings Do Engineers Really Fix? The Compiler That Cried Wolf,https://www.computer.org/csdl/proceedings-article/msr/2023/118400a451/1OIL2VTB2s8,2023,MSR
Automating Arduino Programming: From Hardware Setups to Sample Source Code Generation,https://www.computer.org/csdl/proceedings-article/msr/2023/118400a453/1OIL4MEEmRi,2023,MSR
A Dataset of Bot and Human Activities in GitHub,https://www.computer.org/csdl/proceedings-article/msr/2023/118400a465/1OIKWdtLCG4,2023,MSR
Optimizing Duplicate Size Thresholds in IDEs,https://www.computer.org/csdl/proceedings-article/msr/2023/118400a470/1OIKYkGZiz6,2023,MSR
Boosting Just-in-Time Defect Prediction with Specific Features of C/C++ Programming Languages in Code Changes,https://www.computer.org/csdl/proceedings-article/msr/2023/118400a472/1OIL3RLdbry,2023,MSR
A Large Scale Analysis of Semantic Versioning in NPM,https://www.computer.org/csdl/proceedings-article/msr/2023/118400a485/1OIL1dpKtdC,2023,MSR
Phylogenetic Analysis of Reticulate Software Evolution,https://www.computer.org/csdl/proceedings-article/msr/2023/118400a498/1OIKWAMihCo,2023,MSR
PyMigBench: A Benchmark for Python Library Migration,https://www.computer.org/csdl/proceedings-article/msr/2023/118400a511/1OIKZQimeU8,2023,MSR
Determining Open Source Project Boundaries,https://www.computer.org/csdl/proceedings-article/msr/2023/118400a516/1OIKYZedIek,2023,MSR
Intertwining Communities: Exploring Libraries that Cross Software Ecosystems,https://www.computer.org/csdl/proceedings-article/msr/2023/118400a518/1OIL3ieNxcY,2023,MSR
"Helm Charts for Kubernetes Applications: Evolution, Outdatedness and Security Risks",https://www.computer.org/csdl/proceedings-article/msr/2023/118400a523/1OIL4ierRwA,2023,MSR
Control and Data Flow in Security Smell Detection for Infrastructure as Code: Is It Worth the Effort?,https://www.computer.org/csdl/proceedings-article/msr/2023/118400a534/1OIL4cM60tG,2023,MSR
"Method Chaining Redux: An Empirical Study of Method Chaining in Java, Kotlin, and Python",https://www.computer.org/csdl/proceedings-article/msr/2023/118400a546/1OIL5jnlvuo,2023,MSR
Snapshot Testing Dataset,https://www.computer.org/csdl/proceedings-article/msr/2023/118400a558/1OIKZAybIAg,2023,MSR
"Large Language Models and Simple, Stupid Bugs",https://www.computer.org/csdl/proceedings-article/msr/2023/118400a563/1OIL2oA02UE,2023,MSR
LLMSecEval: A Dataset of Natural Language Prompts for Security Evaluations,https://www.computer.org/csdl/proceedings-article/msr/2023/118400a588/1OIL0T2jTgs,2023,MSR
"Defectors: A Large, Diverse Python Dataset for Defect Prediction",https://www.computer.org/csdl/proceedings-article/msr/2023/118400a593/1OIKYJUJu8w,2023,MSR
A Study of Gender Discussions in Mobile Apps,https://www.computer.org/csdl/proceedings-article/msr/2023/118400a598/1OIKXYdgPUk,2023,MSR
Tell Me Who Are You Talking to and I Will Tell You What Issues Need Your Skills,https://www.computer.org/csdl/proceedings-article/msr/2023/118400a611/1OIL5ACU3Bu,2023,MSR
She Elicits Requirements and He Tests: Software Engineering Gender Bias in Large Language Models,https://www.computer.org/csdl/proceedings-article/msr/2023/118400a624/1OIL38YQCcw,2023,MSR
GitHub OSS Governance File Dataset,https://www.computer.org/csdl/proceedings-article/msr/2023/118400a630/1OIKZukIrWE,2023,MSR
State of Refactoring Adoption: Better Understanding Developer Perception of Refactoring,https://www.computer.org/csdl/proceedings-article/msr/2023/118400a635/1OIL16FDkCA,2023,MSR