Paper Name,Link,Year,Type,Analysed,MSR,SA,MSR4SA,Rank,Data Extraction,Note,Description,
Identifying and evaluating software architecture erosion,https://boa.unimib.it/retrieve/handle/10281/199005/287440/phd_unimib_723299.pdf,2018,Thesis,No,Yes,Yes,Yes,Not ranked,,,"The main contributions of the thesis are: 1) the development of Arcan, a tool for architectural smells detection on Java projects, 2) the validation of Arcan results, 3) different empirical analysis on architectural smells related to architectural smells prediction, and the possible correlations existing between architectural smells and code smells, 4) the definition of a new architectural smells index",
System and software quality models,https://www.iso.org/obp/ui/#iso:std:iso-iec:25010:ed-1:v1:en,2015,ISO/IEC,No,No,No,No,,,,"The quality models in this International Standard can be used to identify relevant quality characteristics that can be further used to establish requirements, their criteria for satisfaction and the corresponding measures",
On evaluating the impact of the refactoring of architectural problems on software quality,https://dl-acm-org.proxy-ub.rug.nl/doi/10.1145/2962695.2962716,2016,XP,No,Yes,Yes,Yes,B,,,"In this paper, they focus their attention on architectural problems, as architectural smells or antipatterns represent, they remove some of these problems through refactoring steps and they check the impact that the refactoring has on different quality metrics",
Design Smell Detection and Analysis for Open Source Java Software,https://ieeexplore-ieee-org.proxy-ub.rug.nl/document/8919054,2019,ICSME,No,Yes,Yes,Yes,A,,,This research aims to provide a tool which uses software metrics as a guide to detect smells and also deploys Spectral Clustering to mine the software repositories and group similar smells,
Tool Support for the Migration to Microservice Architecture: An Industrial Case Study,https://link-springer-com.proxy-ub.rug.nl/chapter/10.1007/978-3-030-29983-5_17,2019,ECSA,Yes,,,,,,,"It is part of the ECSA conference, so it is already analysed",
inSet: A Tool to Identify Architecture Smells Using Machine Learning,https://dl-acm-org.proxy-ub.rug.nl/doi/10.1145/3422392.3422507,2020,SBES,No,Yes,Yes,Yes,Not ranked,,Braziliian,This paper presents a machine learning-based tool to detect the architectural smells Unstable Dependency(UD) and God Component(GC),
An Evolutionary Analysis of Software-Architecture Smells,https://ieeexplore-ieee-org.proxy-ub.rug.nl/document/9609226,2021,ICSME,No,Yes,Yes,Yes,A,Yes (Dennis),,"In this paper, they provide valuable insights regarding what Architecture Smells (ASs) are meaningful to assure system quality. To this end, they analyzed the evolution of three types of ASs in 14 open-source systems with a total of 485 versions",
Measuring affective states from technical debt: A psychoempirical software engineering experiment,https://www.researchgate.net/publication/344347633_Measuring_affective_states_from_technical_debt_A_psychoempirical_software_engineering_experiment,2021,Empirical Software Engineering,No,No,No,No,,,,"This study's objective was to investigate the relationship between technical debt and affective states (feelings, emotions, and moods) from software practitioners",
"Internal Software Quality Evaluation of Self-adaptive Systems Using Metrics, Patterns, and Smells",https://link-springer-com.proxy-ub.rug.nl/chapter/10.1007/978-3-030-70006-5_16,2020,ENASE,No,Yes,Yes,Yes,B,,,"They analyze 20 self-adaptive systems using 4 different quality evaluation mechanisms: software metrics, design patterns, code and architectural smells",
Accumulation and Priorization of Architectural Debt in Three Companies Migrating to Microservices,https://ieeexplore-ieee-org.proxy-ub.rug.nl/document/9732968,2022,IEEE Access,No,No,Yes,No,,,,"This study aims to identify, during migration, which MS-ATDs occur, are the most severe, and are the most challenging to solve. They interviewed 47 practitioners with several roles to identify the debts in their contexts",
The Impact of Human Factors on Software Sustainability,https://link-springer-com.proxy-ub.rug.nl/chapter/10.1007/978-3-030-69970-3_12,2021,Chapter,No,No,No,No,,,,This chapter presents a detailed and inclusive study covering human factor-related challenges of and approaches to software sustainability,
Toward Agile Architecture: Insights from 15 Years of ATAM Data,https://ieeexplore-ieee-org.proxy-ub.rug.nl/document/7024074,2015,IEEE Software,No,No,Yes,No,,,,The study results provide insights for agile teams allocating architecture-related tasks to iterations,
A review of machine learning algorithms for identification and classification of non-functional requirements,https://www-sciencedirect-com.proxy-ub.rug.nl/science/article/pii/S2590188519300010?via%3Dihub,2019,Expert Systems with Applications: X,No,Yes,No,No,,,,"It is a systematic literature review, so it is outside of our scope",
Detecting terminological ambiguity in user stories: Tool and experimentation,https://www-sciencedirect-com.proxy-ub.rug.nl/science/article/pii/S0950584918300715?via%3Dihub,2019,Information and Software Technology,No,No,No,No,,,,"They study whether a synergy between humans' analytic capabilities and natural language processing is an effective approach for quickly identifying near-synonyms, a possible source of terminological ambiguity",
Automatically Classifying Requirements from App Stores: A Preliminary Study,https://ieeexplore-ieee-org.proxy-ub.rug.nl/document/8054879,2017,REW,No,No,No,No,,,,In this paper they apply self-labeling algorithms as Semi-Supervised Classification techniques in order to automate the classification of functional and non-functional requirements contained in reviews in the App Store,
A few useful things to know about machine learning,https://dl-acm-org.proxy-ub.rug.nl/doi/10.1145/2347736.2347755,2012,Communications of the ACM,No,No,No,No,,,,"This article summarizes 12 key lessons that machine learning researchers and practitioners have learned. These include pitfalls to avoid, important issues to focus on, and answers to common questions",
Reference architectures and Scrum: friends or foes?,https://dl-acm-org.proxy-ub.rug.nl/doi/10.1145/3106237.3117773,2017,ESEC/FSE,No,No,Yes,No,,,,"In this paper, they present lessons learned about how reference architectures interact with Scrum",
Architecture-driven quality requirements prioritization,https://ieeexplore-ieee-org.proxy-ub.rug.nl/document/6344554/footnotes#footnotes,2012,TwinPeaks,No,No,Yes,No,,,,They propose a tool-supported method for architecture-driven feedback into requirements prioritization,
Automatic Classification of Non-Functional Requirements from Augmented App User Reviews,https://dl-acm-org.proxy-ub.rug.nl/doi/10.1145/3084226.3084241,2017,EASE,No,No,No,No,,,,"In this paper, user reviews were automatically classified into four types of Non-Functional Requirements (reliability, usability, portability, and performance), Functional Requirements (FRs), and Others",
Continuous Architecture: Towards the Goldilocks Zone and Away from Vicious Circles,https://ieeexplore-ieee-org.proxy-ub.rug.nl/document/8703921,2019,ICSA,Yes,,,,,,,"It is part of the ICSA conference, so it is already analysed",
How Much Up-Front? A Grounded theory of Agile Architecture,https://ieeexplore-ieee-org.proxy-ub.rug.nl/document/7194587,2015,ICSE,No,No,Yes,No,,,,This paper presents a grounded theory of agile architecture that describes how agile software teams answer the question of how much upfront architecture design efforts in enough,
A Literature Review of Using Machine Learning in Software Development Life Cycle Stages,https://ieeexplore-ieee-org.proxy-ub.rug.nl/abstract/document/9568959,2021,IEEE Access,No,No,No,No,,,,"The overall aim of this article is to investigate the relationship between software development life cycle stages, and machine learning tools, techniques, and types",
User Stories and Natural Languge Processing: A Systematic Literature Review,https://ieeexplore-ieee-org.proxy-ub.rug.nl/document/9393933,2021,IEEE Access,No,No,No,No,,,,They conduct a systematic literature review to capture the current state-of-art of NLP research on user stories ,
"Performance Solutions: A Practical Guide to Creating Responsive, Scalable Software",https://www.amazon.com/Performance-Solutions-Practical-Creating-Responsive/dp/0201722291,2003,Book,No,No,No,No,,,,This book is primarily intended for experienced software developers who have used object-oriented techniques on one or more development projects and who are ready for the next step: to learn how to create software systems with built-in scalability and performance,
Model-based performance prediction in software development: a survey,https://ieeexplore-ieee-org.proxy-ub.rug.nl/document/1291833,2004,IEEE Transactions on Software Engineering,No,No,No,No,,,,"In this paper, they present a comprehensive review of recent research at software development time in order to assess the maturity of the field and point out promising research directions",
Precise memory leak detection for java software using container profiling,https://dl-acm-org.proxy-ub.rug.nl/doi/10.1145/2491509.2491511,2013,ACM Transactions on Software Engineering and Methodology,No,Yes,No,No,,,,"In this article they introduce a novel container-based heap-tracking technique, based on the fact that many memory leaks in Java programs occur due to incorrect uses of containters, leading to containters that keep references to unused data entries",
A qualitative study on performance bugs,https://ieeexplore-ieee-org.proxy-ub.rug.nl/document/6224281,2012,MSR,Yes,,,,,,,"It is part of the MSR conference, so it is already analyzed",
Static Detection of Loop-Invariant Data Structures,https://link-springer-com.proxy-ub.rug.nl/chapter/10.1007/978-3-642-31057-7_32,2012,ECOOP,No,Yes,No,No,,,,"Their work targets data structures that are loop-invariant, and presents a static type and effect system to detect loop-invariant data structures",
Speedoo: Prioritizing Performance Optimization Oppertunities,https://ieeexplore-ieee-org.proxy-ub.rug.nl/document/8453154,2018,ICSE,No,Yes,Yes,Yes,A*,,,"This paper contributes a new approach, named Speedoo, to identify groups of methods that should be treated together and deserve high priorities for performance optimization",
Efficient path profiling,https://dl-acm-org.proxy-ub.rug.nl/doi/10.5555/243846.243857,1996,MICRO,No,No,No,No,,,,This paper describes a new algorithm for path profiling,
Software profiling for hot path prediction: less is more,https://dl-acm-org.proxy-ub.rug.nl/doi/10.1145/356989.357008,2000,ACM SIGPLAN Notices,No,No,No,No,,,,"In this paper, they show that sophisticated software profiling schemes that provide highly accurate information in an offline setting are ill-suited for dynamic code generation systems",
Whole program paths,https://dl-acm-org.proxy-ub.rug.nl/doi/10.1145/301631.301678,1999,ACM SIGPLAN Notices,No,No,No,No,,,,This paper explains how to collect and represent Whole Program Paths,
Generating Performance Distributions via Probabilistic Symbolic Execution,https://ieeexplore-ieee-org.proxy-ub.rug.nl/document/7886891,2016,ICSE,No,No,No,No,,,,"In this paper, they propose a performance analysis framework PerfPlotter. It takes the program source code and usage profile as inputs and generates a performance distribution that captures the input probability distribution over execution times for the program",
Input-sensitive profiling,https://dl-acm-org.proxy-ub.rug.nl/doi/10.1145/2254064.2254076,2012,PLDI,No,Yes,No,No,,,,In this paper they present a profiling methodology and toolkit for helping developers discover hidden asympotic inefficiencies in the code,
Efficient flow profiling for detecting performance bugs,https://dl-acm-org.proxy-ub.rug.nl/doi/10.1145/2931037.2931066,2016,ISSTA,No,Yes,No,No,,,,"In this paper, they design and implement an efficient instrumentation technique that efficiently generates object flow profiles for Java programs, without requiring any modifications to the underlying virtual machine",
Automatically finding performance problems with feedback-directed learning software testing,https://ieeexplore-ieee-org.proxy-ub.rug.nl/abstract/document/6227197,2012,ICSE,No,Yes,No,No,,,,They offer a novel solution for finding performance problems in applications automatically using black-box software testing,
Automating performance bottleneck detection using search-based application profiling,https://dl-acm-org.proxy-ub.rug.nl/doi/10.1145/2771783.2771816,2015,ISSTA,No,Yes,No,No,,,,They propose a novel approach for automating performance bottleneck detection using search-based input-sensitive application profiling,
EvoSuite: automatic test suite generation for object-oriented software,https://dl-acm-org.proxy-ub.rug.nl/doi/10.1145/2025113.2025179,2011,ESEC/FSE,No,No,No,No,,,,"This paper presents EvoSuite, a tool that automatically generates test cases with assertions for classes written in Java code",
Finding reusable data structures,https://dl-acm-org.proxy-ub.rug.nl/doi/10.1145/2398857.2384690,2012,ACM SIGPLAN Notices,No,No,No,No,,,,This paper presents a run-time technique that can be used to help programmers find allocation sites that create data structures with disjoint lifetimes to improve performance,
Brainy: effective selection of data structures,https://dl-acm-org.proxy-ub.rug.nl/doi/10.1145/1993316.1993509,2011,ACM SIGPLAN Notices,No,Yes,No,Yes,Not ranked,,,"This paper presents the design and evaluation of Brainy, a new program analysis tool that automatically selects the best data structure for a given program and its input on a specific microarchitecture",
Finding low-utility data structures,https://dl-acm-org.proxy-ub.rug.nl/doi/10.1145/1809028.1806617,2010,ACM SIGPLAN Notices,No,Yes,No,No,,,,"They demonstrate two client analyses: one that finds objects that are expensive to construct but are not necessary for the forward execution, and second that pinpoints ultimately-dead values",
Performance Issues and Optimizations in JavaScript: An Empirical Study,https://ieeexplore-ieee-org.proxy-ub.rug.nl/document/7886892,2016,ICSE,No,Yes,No,No,,,,This paper presents an empirical study of 98 fixed performance issues from 16 popular client-side and server-side JavaScript projects,
Perflint: A Context Sensitive Performance Advisor for C++ Programs,https://ieeexplore-ieee-org.proxy-ub.rug.nl/document/4907670,2009,CGO,No,Yes,No,No,,,,"They present perflint, a new industrial strength open source analysis tool that identifies suboptimal use patterns of the C++ standard library",
CoCo: Sound and Adaptive Replacement of Java Collections,https://link-springer-com.proxy-ub.rug.nl/chapter/10.1007/978-3-642-39038-8_1,2013,ECOOP,No,Yes,No,No,,,,"This paper presents an application-level dynamic optimization technique called CoCo, that exploits algorithmic advantages of Java collections to improve performance ",
Chameleon: adaptive selection of collections,https://dl-acm-org.proxy-ub.rug.nl/doi/10.1145/1543135.1542522,2009,ACM SIGPLAN Notices,No,No,No,No,,,,"In this paper, they present CHAMELEON, a low-overhead automatic tool that assists the programmer in choosing the appropriate collection implementation for their application",
Detecting inefficiently-used containters to avoid bloat,https://dl-acm-org.proxy-ub.rug.nl/doi/10.1145/1809028.1806616,2010,ACM SIGPLAN Notices,No,Yes,No,No,,,,This paper presents practical static and dynamic tools that can find inappropriate use of containers in Java programs,
Toddler: Detecting performance problems via similar memory-access patterns,https://ieeexplore-ieee-org.proxy-ub.rug.nl/document/6606602,2013,ICSE,No,Yes,No,No,,,,"This paper presents Toddler, a novel automated oracle for performance bugs, which enables testing for performance bugs to use the well established and automated process of testing for functional bugs",
Caramel: detecting and fixing performance problems that have non-intrusive fixes,https://dl-acm-org.proxy-ub.rug.nl/doi/10.5555/2818754.2818863,2015,ICSE,No,Yes,No,No,,,,"This paper presents Caramel, a novel static technique that detects and fixes performance bugs that have non-intrusive fixes likely to be adopted by developers",
Performance Diagnosis for Inefficient Loops,https://ieeexplore-ieee-org.proxy-ub.rug.nl/document/7985677,2017,ICSE,No,Yes,No,No,,,,"In this paper, they first design a root-cause and fix-strategy taxonomy for inefficient loops, one of the most common performance problems in the field. They then design a static-dynamic hybrid analysis tool, LDoctor, to provide accurate performance diagnosis for loops",
Static detection of asymptotic performance bugs in collection traversals,https://dl.acm.org/doi/10.1145/2813885.2737966,2015,ACM SIGPLAN Notices,No,Yes,No,No,,,,This paper identifies and formalizes a prevalent class of asymptotic performance bugs called redundant traversal bugs and presents a novel static analysis for automatically detecting them,
Directed test generation to detect loop inefficiencies,https://dl.acm.org/doi/10.1145/2950290.2950360,2016,FSE,No,No,No,No,,,,"In this paper, they design a novel, scalable and automatic approach that addresses the design of an approach to automatically generate tests for exposing redundant traversal of loops",
Statistical debugging for real-world performance problems,https://dl.acm.org/doi/10.1145/2660193.2660234,2014,OOPSLA,No,No,No,No,,,,"Their study shows that statistical debugging is a natural fit for diagnosing performance problems, which are often observed through comparison-based approaches and reported together with both good and bad inputs",
Performance problems you can fix: a dynamic analysis of memoization opportunities,https://dl.acm.org/doi/10.1145/2858965.2814290,2015,ACM SIGPLAN Notices,No,No,No,No,,,,"To help developers find and use memoization opportunities, they present MemoizeIt, a dynamic analysis that identifies methods that repeatedly perform the same computation",
Cachetor: detecting cacheable data to remove bloat,https://dl.acm.org/doi/10.1145/2491411.2491416,2013,ESEC/FSE,No,Yes,No,No,,,,"To help the developers quickly find optimization opportunities for performance improvement, they propose a novel run-time profiling tool, called Cachetor, which uses a combination of dynamic dependence profiling and value profiling to identify and report operations that keep generating identical data values",
Jolt: lightweight dynamic analysis and removal of object churn,https://dl-acm-org.proxy-ub.rug.nl/doi/10.1145/1449955.1449775,2008,ACM SIGPLAN Notices,No,No,No,No,,,,"They develop an algorithm that uses capture and control to inline portions of the call graph to make churned object non-escaping, enabling churn optimization via escape analysis",
Understanding and detecting real-world performance bugs,https://dl-acm-org.proxy-ub.rug.nl/doi/10.1145/2345156.2254075,2012,ACM SIGPLAN Notices,No,Yes,No,No,,,,"This paper conducts a comprehensive study of 110 real-world performance bugs that are randomly sampled from five representative software suites (Apache, Chrome, GCC, Mozilla, and MySQL)",
"Discovering, reporting, and fixing performance bugs",https://ieeexplore-ieee-org.proxy-ub.rug.nl/document/6624035,2013,MSR,Yes,,,,,,,"It is part of the MSR conference, so it is already analyzed",
Performance regression testing of concurrent classes,https://dl-acm-org.proxy-ub.rug.nl/doi/10.1145/2610384.2610393,2014,ISSTA,No,Yes,No,No,,,,"This paper presents SpeedGun, an automatic performance regression testing technique for thread-safe classes",
"SyncProf: detecting, localizing, and optimizing synchronization bottlenecks",https://dl-acm-org.proxy-ub.rug.nl/doi/10.1145/2931037.2931070,2016,ISSTA,No,Yes,No,No,,,,"This paper presents SyncProf, a concurrency-focused profiling approach that helps in detecting, localizing, and optimizing synchronization bottlenecks",
Removing unnecessary synchronization in Java,https://dl-acm-org.proxy-ub.rug.nl/doi/pdf/10.1145/320384.320388,1999,ACM SIGPLAN Notices,No,No,No,No,,,,They have developed a program optimization that automatically detects situations where synchronization can be safely suppressed and that rewrites the affected program parts to eliminate the unnecessary synchronizations,
Effective synchronization removal for Java,https://dl-acm-org.proxy-ub.rug.nl/doi/10.1145/349299.349327,2000,PLDI,No,No,No,No,,,,They describe and evaluate the performance of an implementation in the Marmot native Java compiler,
Learning from Source Code History to Identify Performance Failures,https://dl-acm-org.proxy-ub.rug.nl/doi/10.1145/2851553.2851571,2016,ICPE,No,Yes,No,No,,,,This paper contracts source code changes against performance variations,
Titan: a toolset that connects software architecture with quality analysis,https://dl-acm-org.proxy-ub.rug.nl/doi/10.1145/2635868.2661677,2014,FSE,No,Yes,Yes,Yes,B,,,They show how Titan can capture both architecture and evolutionary structure and help bridge the gap between architecture and defect prediction,
Bridging the Gap between Software Architecture and Maintenance Quality,https://www-proquest-com.proxy-ub.rug.nl/docview/1828414950?pq-origsite=gscholar&fromopenview=true,2016,Thesis,No,Yes,Yes,Yes,Not ranked,,,"Their proposed methodology consists of three parts: 1) a new architecture model, called the DRSpace model, which simultaneously captures the modular structure and maintenance ""penalties"" of a software system; 2) an Architecture Root detection algorithm that automatically identifies the most problematic design spaces, aggregating bug-prone files in a software system; and 3) a formal definition of Architectural Debt and an approach that automatically identifies such debts, and quantifies the ""costs"" and ""interest rates"" of such debts",
A Linked Data platform for mining software repositories,https://ieeexplore-ieee-org.proxy-ub.rug.nl/document/6224296,2012,MSR,Yes,,,,,,,"It is part of the MSR conference, so it is already analyzed",
The missing links: bugs and bug-fix commits,https://dl-acm-org.proxy-ub.rug.nl/doi/10.1145/1882291.1882308,2010,FSE,No,No,No,No,,,,"First, they present Linkster, a tool to facilitate link reverse-engineering. Second, they evaluate this tool, engaging a core developer of the Apache HTTP web server project to exhaustively annotate 493 commits that occured during a six week period. Finally, they analyze this comprehensive data set, showing that there are serious and consequential problems in the data",
ReLink: recovering links between bugs and changes,https://dl-acm-org.proxy-ub.rug.nl/doi/10.1145/2025113.2025120,2011,ESEC/FSE,No,Yes,No,No,,,,"They developed an automatic link recovery algorithm, ReLink, which automatically learns criteria of features from explicit links to recover missing links. They have applied ReLink to three open source projects",
Recovering traceability links in software artifact management systems using information retrieval methods,https://dl-acm-org.proxy-ub.rug.nl/doi/10.1145/1276933.1276934,2007,ACM Transactions on Software Engineering and Methodology,No,No,No,No,,,,"They have improved an artifact management system with a traceability recovery tool based on Latent Semantic Indexing (LSI), an information retrieval technique. They have assessed LSI to identify strengths and limitations of using information retrieval techniques for traceability recovery and devised the need for an incremental approach",
Recovering traceability links between source code and fixed bugs via patch analysis,https://dl-acm-org.proxy-ub.rug.nl/doi/10.1145/1987856.1987863,2011,TEFSE,No,Yes,No,No,,,,"They use BugTrace, the tool implementing their approach, to conduct a case study in which they compare the links recovered by their approach to links recovered by manual inspection",
Overview of Teknowledge's domain-specific software architecture program,https://dl-acm-org.proxy-ub.rug.nl/doi/10.1145/190679.190686,1994,ACM SIGSOFT Software Engineering Notes,No,No,Yes,No,,,,"In conjunction with their collaborators at ARDEC, they have produced a schema for describing architectures which is being used by ARDEC's community of contractors, by an ARPA architecture specification project for the Joint Task Force ATD, and by the Stanford Knowledge Systems Laboratory",
ArchJava: connecting software architecture to implementation,https://ieeexplore-ieee-org.proxy-ub.rug.nl/document/1007967,2002,ICSE,No,Yes,Yes,Yes,A*,,1 program,"ArchJava is an extension to Java that seamlessly unifies software architecture with implementation, ensuring that the implementation conforms to architectural constraints. A case study applying ArchJava to a circuit-design application suggests that ArchJava can express architectural structure effectively within an implementation, and that it can aid in program understanding and software evolution",
Feature-gathering dependency-based software clustering using Dedication and Modularity,https://ieeexplore-ieee-org.proxy-ub.rug.nl/document/6405308,2012,ICSM,No,Yes,No,No,,,Software clustering algorithm. SA is not explicitly mentioned,"In this paper, they proposed a novel dependency-based software clustering algorithm, SArF",
Software Clustering: Unifying Syntactic and Semantic Features,https://ieeexplore-ieee-org.proxy-ub.rug.nl/document/6385107,2012,WCRE,No,Yes,No,No,,,Software clustering algorithm. SA is not explicitly mentioned,"One of the limitations of the existing software clustering approaches is that most of the proposed techniques use only similar types of features for esitmating distance between source code elements. Therefore, in cases, where the selected features are poorly present in the source code, these techniques may not produce good quality results in absence of adequate inputs to work on. In this paper they propose an approach to overcome this limitation",
