Paper Name,Link,Year,Type,Analysed,MSR,SA,MSR4SA,Rank,Data Extraction,Note,Description,
Peer Code Review to Prevent Security Vulnerabilities: An Empirical Evaluation,https://ieeexplore-ieee-org.proxy-ub.rug.nl/document/6616350,2013,SERE,No,No,No,No,,,,They propose a research plan to analyze mature open source projects to gather empirical evidence regarding the relationship between peer code review and security vulnerabilities,
Architectural Approaches to Security: Four Case Studies,https://ieeexplore-ieee-org.proxy-ub.rug.nl/abstract/document/7742194,2016,Computer,No,Yes,Yes,Yes,A*,,,"To support their assertion that frameworks are essential to a secure system, they studied three industrial projects and one open source project to gather empirical evidence about security practices",
Revisiting Architectural Tactics for Security,https://link-springer-com.proxy-ub.rug.nl/chapter/10.1007/978-3-319-23727-5_5,2015,ECSA,Yes,,,,,,,"It is part of the ECSA conference, so it is already analyzed",
Game of detections: how are security vulnerabilities discovered in the wild?,https://link-springer-com.proxy-ub.rug.nl/article/10.1007/s10664-015-9403-7,2015,Empirical Software Engineering,No,No,No,No,,,,The goal of this paper is to understand the methods and tools used during the discovery and whether the community of developers exploring one security vulnerability differs-in their approach-from another community of developers exploring a different vulnerability,
Architectural Risk Analysis of Software Systems Based on Security Patterns,https://ieeexplore-ieee-org.proxy-ub.rug.nl/document/4384502,2008,IEEE Transactions on Dependable and Secure Computing,No,Yes,Yes,Yes,A,,,The main goal of this paper is to perform risk analysis of software systems based on the security patterns that they contain,
Reusable Formal Models for Secure Software Architectures,https://ieeexplore-ieee-org.proxy-ub.rug.nl/document/6337760,2012,WICSA/ECSA,Yes,,,,,,,"It is part of the WICSA/ECSA conference, so it is already analyzed",
How Software Designs Decay: A Pilot Study of Pattern Evolution,https://ieeexplore-ieee-org.proxy-ub.rug.nl/document/4343775,2007,ESEM,No,Yes,Yes,Yes,A,Yes (Dennis),1 system,This research examines the extent to which software designs actually decay by studying the aging of design patterns in successful object oriented systems,
When a Patch Goes Bad: Exploring the Properties of Vulnerability-Contributing Commits,https://ieeexplore-ieee-org.proxy-ub.rug.nl/document/6681339,2013,ESEM,No,Yes,No,No,,,,"In this paper, they traced 68 vulnerabilities in the Apache HTTP server back to the version control commits that contributed the vulnerable code originally",
"Modifications, Tweaks, and Bug Fixes in Architectural Tactics",https://ieeexplore-ieee-org.proxy-ub.rug.nl/document/7180098/citations#citations,2015,MSR,Yes,,,,,,,"It is part of the MSR conference, so it is already analyzed",
The Use of Security Tactics in Open Source Software Projects,https://ieeexplore-ieee-org.proxy-ub.rug.nl/document/7362260,2016,IEEE Transactions on Reliability,No,Yes,Yes,Yes,A,,,"In this study, they examine the extent of the discrepancy between an architect's vision of what security tactics need to be adopted in the software and the actual implementation",
Context-Based Architectural Security Analysis,https://ieeexplore-ieee-org.proxy-ub.rug.nl/document/7516846,2016,WICSA,Yes,,,,,,,"It is part of the WICSA/ECSA conference, so it is already analyzed",
Guidelines for industrially-based multiple case studies in software engineering,https://ieeexplore-ieee-org.proxy-ub.rug.nl/document/5089295,2009,RCIS,No,No,No,No,,,,"Through a synthesis of existing best practices in case study research, they provide a set of comprehensive guidelines for conducting multiple case studies in software engineering research",
Session management vulnerabilities in today's web,https://ieeexplore-ieee-org.proxy-ub.rug.nl/document/5487488,2010,IEEE Security & Privacy,No,No,No,No,,,,This article describes Web application design flaws that could be exploited for session management attacks and discusses these flaws' current prevalence,
Design Science Methodology for Information Systems and Software Engineering,https://link-springer-com.proxy-ub.rug.nl/book/10.1007/978-3-662-43839-8,2014,Book,No,No,No,No,,,,This book provides guidelines for practicing design science in the fields of information systems and software engineering research,
Mining Software Component Interactions to Detect Security Threats at the Architectural Level,https://ieeexplore-ieee-org.proxy-ub.rug.nl/document/7516831,2016,WICSA,Yes,,,,,,,"It is part of the WICSA/ECSA conference, so it is already analyzed",
Evaluation Methods and Replicability of Software Architecture Research Objects,https://ieeexplore-ieee-org.proxy-ub.rug.nl/document/9779698,2022,ICSA,Yes,,,,,,,"It is part of the ICSA conference, so it is already analysed",
A Program Synthesis Approach for Adding Architectural Tactics to An Existing Code Base,https://ieeexplore-ieee-org.proxy-ub.rug.nl/document/9678705,2021,ASE,No,No,Yes,No,,,,"In this paper, they introduce a novel program synthesis approach that synthesizes and adds architectural tactics to an existing code base",
Secure Software Development in the Era of Fluid Multi-party Open Software and Services,https://ieeexplore-ieee-org.proxy-ub.rug.nl/document/9402257,2021,ICSE-NIER,No,No,No,No,,,,"In this paper, they aim to provide an overview of the current software security approaches and evaluate their appropriateness in the face of the changed nature in software development",
Strategies for Pattern-Based Detection of Architecturally-Relevant Software Vulnerabilities,https://ieeexplore-ieee-org.proxy-ub.rug.nl/document/9101224/references#references,2020,ICSA,Yes,,,,,,,"It is part of the ICSA conference, so it is already analysed",
Architectural Security Weaknesses in Industrial Control Systems (ICS) an Empirical Study Based on Disclosed Software Vulnerabilities,https://ieeexplore-ieee-org.proxy-ub.rug.nl/document/8703918,2019,ICSA,Yes,,,,,,,"It is part of the ICSA conference, so it is already analysed",
Understanding Software Security from Design to Deployment,https://dl-acm-org.proxy-ub.rug.nl/doi/abs/10.1145/3385678.3385687,2020,ACM SIGSOFT Software Engineering Notes,No,No,No,No,,,,"In this workshop, they aimed to bring the research and practitioner communities of requirements engineers, security experts, architect developers, and testers together to identify foundations, and challenges, and to formulate solutions related to automating the analysis design, implementation, testing, and maintenance of secure software systems",
A Demand-Side Viewpoint to Software Vulnerabilities in WordPress Plugins,https://dl-acm-org.proxy-ub.rug.nl/doi/10.1145/3319008.3319029,2019,EASE,No,Yes,No,No,,,,This paper analyzes known software vulnerabilities discovered from WordPress plugins,
A Principled Way to Use Frameworks in Architecture Design,https://ieeexplore-ieee-org.proxy-ub.rug.nl/document/6365644,2013,IEEE Software,No,No,Yes,No,,,,They stress the importance of considering technologies--specifically frameworks--as first-class design concepts,
Data-Driven Selection of Security Application Frameworks During Architectural Design,https://scholarspace.manoa.hawaii.edu/items/5a03fc55-07c7-403e-b116-41553799f150,2019,Hawaii International Conference on System Sciences,No,No,Yes,No,,,,In this paper they investigate the criteria used by practicing software architects in selecting security frameworks,
A search engine for finding and reusing architecturally significant code,https://www-sciencedirect-com.proxy-ub.rug.nl/science/article/pii/S0164121216302345?via%3Dihub,2017,Journal of Systems and Software,No,No,Yes,No,,,,They created a novel Tactic Search Engine called ArchEngine (ARCHitecture search ENGINE). ArchEngine can replace this manual internet-based search process and help developers find and reuse tactical code from a wide range of open source systems,
What Makes APIs Hard to Learn? Answers from Developers,https://ieeexplore-ieee-org.proxy-ub.rug.nl/document/5287006,2009,IEEE Software,No,No,No,No,,,,This article focuses on the obstacles to learning an API,
Documenting frameworks using patterns,https://dl-acm-org.proxy-ub.rug.nl/doi/10.1145/141937.141943,1992,ACM SIGPLAN Notices,No,No,No,No,,,,"This paper shows how to use patterns to document a framework, and includes a set of patterns for HotDraw as an example",
Usage and attribution of Stack Overflow code snippets in GitHub projects,https://link-springer-com.proxy-ub.rug.nl/article/10.1007/s10664-018-9650-5,2018,Empirical Software Engineering,No,Yes,No,No,,,,They present results of a large-scale empirical study analyzing the usage and attribution of non-trivial Java code snippers from Stack Overflow answers in public GitHub projects,
Stack Overflow Considered Harmful? The Impact of Copy&Paste on Android Application Security ,https://ieeexplore-ieee-org.proxy-ub.rug.nl/document/7958574,2017,SP,No,Yes,No,No,,,,They quantify the proliferation of security-related code snippets from Stack Overflow in Android applications available on Google Play,
Mining API patterns as partial orders from source code: from usage scenarios to specifications,https://dl-acm-org.proxy-ub.rug.nl/doi/10.1145/1287624.1287630,2007,ESEC-FSE,No,Yes,No,No,,,,"In this paper, they present a framework to automatically extract usage scenarios among user-specified APIs as partial orders, directly from the source code (API client code)",
Static Specification Mining Using Automata-Based Abstractions,https://ieeexplore-ieee-org.proxy-ub.rug.nl/document/4589215,2008,IEEE Transactions on Software Engineering,No,No,No,No,,,,They present a novel approach to client-side mining of temporal API specifications based on static analysis,
Mining framework usage graphs from app corpora,https://ieeexplore-ieee-org.proxy-ub.rug.nl/document/8330216,2018,SANER,No,Yes,No,No,,,,"They investigate the problem of mining graph-based usage patterns for large, object-oriented frameworks like Android--revisiting previous approaches based on graph-based object usage models (groums)",
Parameter-free probabilistic API mining across GitHub,https://dl-acm-org.proxy-ub.rug.nl/doi/10.1145/2950290.2950319,2016,FSE,No,Yes,No,No,,,,"They present PAM (Probabilistic API Miner), a near parameter-free probabilistic algorithm for mining the most interesting API call patterns",
Pravaaha: Mining Android Applications for Discovering API Call Usage Patterns and Trends,https://dl-acm-org.proxy-ub.rug.nl/doi/10.1145/2723742.2723743,2015,ISEC,No,Yes,No,No,,,,"In this paper, they present the results of their large-scale API usage analysis of Android applications",
Investigating Next Steps in Static API-Misuse Detection,https://ieeexplore-ieee-org.proxy-ub.rug.nl/document/8816795,2019,MSR,Yes,,,,,,,"It is part of the MSR conference, so it is already analyzed",
An Empirical Study on API Usages,https://ieeexplore-ieee-org.proxy-ub.rug.nl/document/8186224,2019,IEEE Transactions on Software Engineering,No,Yes,No,No,,,,"In this paper, they conduct an empirical study on API usages, with an emphasis on how different types of APIs are used",
MAPO: Mining and Recommending API Usage Patterns,https://link-springer-com.proxy-ub.rug.nl/chapter/10.1007/978-3-642-03013-0_15,2009,ECOOP,No,Yes,No,No,,,,They have developed an API an API usage mining framework and its supporting tool called MAPO (Mining API usage Pattern from Open source repositories) for mining API usage patterns automatically,
MACs: Mining API code snippets for code reuse,https://www-sciencedirect-com.proxy-ub.rug.nl/science/article/pii/S0957417410013849?via%3Dihub,2011,Expert Systems with Applications,No,Yes,No,No,,,,They apply data mining to source code projects to guide developers through related API usage patterns,
Towards the automated recovery of complex temporal API-usage patterns,https://dl-acm-org.proxy-ub.rug.nl/doi/10.1145/3205455.3205622,2018,GECCO,No,Yes,No,No,,,,"In this paper, they discuss the problem of temporal usage patterns recovery and propose a genetic-programming algorithm to solve it",
Towards assisting developers in API usage by automated recovery of complex temporal patterns,https://www-sciencedirect-com.proxy-ub.rug.nl/science/article/pii/S0950584918301642?via%3Dihub,2020,Information and Software Technology,No,Yes,No,No,,,,"In this paper, they discuss the problem of temporal usage patterns recovery and propose an algorithm to solve it",
CodeKernel: A Graph Kernel Based Approach to the Selection of API Usage Examples,https://ieeexplore-ieee-org.proxy-ub.rug.nl/document/8952546,2019,ASE,No,Yes,No,No,,,,"They propose CodeKernel, a graph kernel based approach to the selection of API usage examples",
API recommendation system for software development,https://ieeexplore-ieee-org.proxy-ub.rug.nl/document/7582836,2016,ASE,No,No,No,No,,,,"In this work, the author plans to automatically recommend relevant APIs to developers",
Cross-library API recommendation using web search engines,https://dl-acm-org.proxy-ub.rug.nl/doi/10.1145/2025113.2025197,2011,ESEC-FSE,No,No,No,No,,,,"In this paper, they propose to mine search results of Web search engines to recommend related APIs of different libraries",
"Demystify Official API Usage Directives with Crowdsourced API Misuse Scenarios, Erroneous Code Examples and Patches",https://ieeexplore-ieee-org.proxy-ub.rug.nl/document/9283947,2020,ICSE,No,Yes,No,No,,,,"They develop a text mining approach to discover the crowdsourced API misuse scenarios on Stack Overflow and extract from these scenarios erroneuous code examples and patches, as well as related API and confusing APIs to construct demystification reports to help developers understand the official API usage directives described in natural language",
Detecting missing method calls as violations of the majority rule,https://dl-acm-org.proxy-ub.rug.nl/doi/10.1145/2430536.2430541,2013,ACM Transactions on Software Engineering and Methodology,No,Yes,No,No,,,,They propose a new system that searches for missing method calls in software based on the other method calls that are observable,
A Systematic Evaluation of Static API-Misuse Detectors,https://ieeexplore-ieee-org.proxy-ub.rug.nl/document/8338426,2019,IEEE Transactions on Software Engineering,No,Yes,No,No,,,,"In this paper, they present the first-ever qualitative and quantitative evaluation that compares static API-misuse detectors along the same dimensions, and with original author validation",
Detecting object usage anomalies,https://dl-acm-org.proxy-ub.rug.nl/doi/10.1145/1287624.1287632,2007,ESEC-FSE,No,Yes,No,No,,,,Their approach takes code examples to automatically infer legal sequences of method calls,
"Mining Big Data for Detecting, Extracting and Recommending Architectural Design Concepts",https://ieeexplore-ieee-org.proxy-ub.rug.nl/document/7166053,2015,BIGDSE,No,Yes,Yes,Yes,Not ranked,,,"They mine big data to detect and extract a large set of architectural design concepts, such as design patterns, design tactics, architecture styles, etc., to be used in their architecture recommender system called ARS",
Call graph construction in object-oriented languages,https://dl-acm-org.proxy-ub.rug.nl/doi/10.1145/263700.264352,1997,ACM SIGPLAN Notices,No,Yes,No,No,,,,This paper presents a parameterized algorithmic framework for call graph construction in the presence of message sends and/or first class functions,
Control-flow analysis of higher-order languages of taming lambda,https://dl-acm-org.proxy-ub.rug.nl/doi/10.5555/124950,1991,Thesis,No,No,No,No,,,,The author presents a technique for recovering the control-flow graph of a Scheme program at compile time,
Interprocedural slicing using dependence graphs,https://dl-acm-org.proxy-ub.rug.nl/doi/10.1145/960116.53994,1988,TOPLAS,No,No,No,No,,,,"They introduce a new kind of graph to represent programs, called a system dependence graph, which extends previous dependence representations to incorporate collections of procedures (with procedure calls) rather than just monolithic programs",
Soot: a Java bytecode optimization framework,https://dl-acm-org.proxy-ub.rug.nl/doi/10.1145/1925805.1925818,2010,CASCON,No,No,No,No,,,,"This paper presents Soot, a framework for optimizing Java bytecode",
Program Slicing,https://ieeexplore-ieee-org.proxy-ub.rug.nl/document/5010248,1984,IEEE Transactions on Software Engineering,No,No,No,No,,,,"Their concern here is with 1) a formal definition of slices and their abstract properties, 2) a practical algorithm for slicing, and 3) some experience slicing real programs",
Graph-based mining of multiple object usage patterns,https://dl-acm-org.proxy-ub.rug.nl/doi/10.1145/1595696.1595767,2009,ESEC/FSE,No,Yes,No,No,,,,"In this paper, they propose GrouMiner, a novel graph-based approach for mining the usage patterns of one or multiple objects",
Automated API Property Inference Techniques,https://ieeexplore-ieee-org.proxy-ub.rug.nl/document/6311409,2013,IEEE Transactions on Software Engineering,No,No,No,No,,,,This paper provides a comprehensive survey of over a decade of research on automated propery inference for APIs,
PR-Miner: automatically extracting implicit programming rules and detecting violations in large software code,https://dl-acm-org.proxy-ub.rug.nl/doi/10.1145/1095430.1081755,2005,ACM SIGSOFT Software Engineering Notes,No,Yes,No,No,,,,This paper proposes a general method called PR-Miner that uses a data mining technique called frequent itemset mining to efficiently extract implicit programming rules from large software code written in an industrial programming language such as C,
ExPort: Detecting and visualizing API usages in large source code repositories,https://ieeexplore-ieee-org.proxy-ub.rug.nl/document/6693127,2013,ASE,No,No,No,No,,,,This paper presents a technique for automatically mining and visualizing API usage examples,
Mining Multi-level API Usage Patterns,https://ieeexplore-ieee-org.proxy-ub.rug.nl/document/7081812,2015,SANER,No,Yes,No,No,,,,They propose a technique for mining Multi-Level API Usage Patterns (MLUP) to exhibit the co-usage relationships between methods of the API of interest across interfering usage scenarios,
Could We Infer Unordered API Usage Patterns Only Using the Library Source Code,https://ieeexplore-ieee-org.proxy-ub.rug.nl/document/7181434,2015,ICPC,No,Yes,No,No,,,,"In this paper, they propose a technique for mining Non Client-based Usage Patterns (NCBUP miner)",
API code recommendation using statistical learning from fine-grained changes,https://dl-acm-org.proxy-ub.rug.nl/doi/10.1145/2950290.2950333,2016,FSE,No,Yes,No,No,,,,They present a novel API recommendation approach that taps into the predictive power of repetitive code changes to provide relevant API recommendations for developers,
HiRec: API Recommendation using Hierarchical Context,https://ieeexplore-ieee-org.proxy-ub.rug.nl/document/8987517,2019,ISSRE,No,Yes,No,No,,,,"They introduce a novel type of context, i.e., hierarchical context, which can leverage the hidden information of project-specific code by analyzing the call graph. Next to this, they propose an approach, i.e., HiRec, which builds on the basis of hierarchical context",
API usage pattern recommendation for software development,https://www-sciencedirect-com.proxy-ub.rug.nl/science/article/pii/S0164121216301200,2017,Journal of Systems and Software,No,Yes,No,No,,,,"In this paper, they explore the possibility of mining API usage patterns without relying on frequent-pattern mining",
FOCUS: A Recommender System for Mining API Function Calls and Usage Patterns,https://ieeexplore-ieee-org.proxy-ub.rug.nl/document/8812051,2019,ICSE,No,Yes,No,No,,,,"In this paper, they reformulate the problem of usage pattern recommendation in terms of a collaborative-filtering recommender system",
LtRules: an automated software library usage rule extraction tool,https://dl-acm-org.proxy-ub.rug.nl/doi/10.1145/1134285.1134424,2006,ICSE,No,Yes,No,No,,,,"They propose to automatically extract software library usage rules, which are one type of temporal specifications",
Automatic parameter recommendation for practical API usage,https://ieeexplore-ieee-org.proxy-ub.rug.nl/document/6227136,2012,ICSE,No,Yes,No,No,,,,"Recently, various techniques have been proposed that create API summarizations, mining code examples, or showing common API call sequences. However, few techniques focus on recommending API parameters. In this paper, they propose an automated technique, called Precise, to address this problem",
Mining succint and high-coverage API usage patterns from source code,https://ieeexplore-ieee-org.proxy-ub.rug.nl/document/6624045,2013,MSR,Yes,,,,,,,"It is part of the MSR conference, so it is already analyzed",
"CSCC: Simple, Efficient, Context Sensitive Code Completion",https://ieeexplore-ieee-org.proxy-ub.rug.nl/document/6976073,2014,ICSME,No,Yes,No,No,,,,"In this paper, they describe a novel technique called CSCC (Context Sensitive Code Completion) for improving the performance of API method call completion",
A graph-based approach to API usage adaptation,https://dl-acm-org.proxy-ub.rug.nl/doi/10.1145/1869459.1869486,2010,OOPSLA,No,Yes,No,No,,,,This paper presents LIBSYNC that guides developers in adapting API usage code by learning complex API usage adaptation patterns from other clients that already migrated to a new library version (and also from the API usages within the library's test code),
"GraPacc: A graph-based pattern-oriented, context-sensitive code completion tool",https://ieeexplore-ieee-org.proxy-ub.rug.nl/document/6227236,2012,ICSE,No,No,No,No,,,,"They introduce GraPacc, an advanced, context-sensitive code completion tool that is based on frequent API usage patterns",
Towards a visualized code recommendation for APIs enriched with specification mining,https://dl-acm-org.proxy-ub.rug.nl/doi/10.1145/2593822.2593825,2014,RSSE,No,No,No,No,,,,This paper positions an idea for an interactive code recommendation system,
Recommending Framework Extension Examples,https://ieeexplore-ieee-org.proxy-ub.rug.nl/document/8094444,2017,ICSME,No,Yes,No,No,,,,They propose and evaluate a graph mining approach for extension point management,
FEMIR: A tool for recommending framework extension examples,https://ieeexplore-ieee-org.proxy-ub.rug.nl/document/8115713,2017,ASE,No,Yes,No,No,,,,"In this paper, they present a tool, called FEMIR, that utilizes partial program analysis and graph mining technique to detect, group, and rank framework extension examples",
Mining Scala Framework Extensions for Recommendation Patterns,https://ieeexplore-ieee-org.proxy-ub.rug.nl/document/8668019,2019,SANER,No,Yes,No,No,,,,"In this paper, they present a differentiated replication study of the work by Asaduzzaman et al. on Java frameworks. Their aim is to replicate the work in order to analyse extension points and extension patterns in the context of Scala frameworks. To this aim, they propose SCALA-XP-MINER, a tool for mining extension patterns in Scala software systems to empirically investigate their hypotheses",
ROSDiscover: Statically Detecting Run-Time Architecture Misconfigurations in Robotics Systems,https://ieeexplore-ieee-org.proxy-ub.rug.nl/document/9779703,2022,ICSA,Yes,,,,,,,"It is part of the ICSA conference, so it is already analysed",
ArCode: A Tool for Supporting Comprehension and Implementation of Architectural Concerns,https://ieeexplore-ieee-org.proxy-ub.rug.nl/document/9462989,2021,ICPC,No,No,Yes,No,,,,"In this paper they present ArCode, a tool designed as a plugin for a popular IDE, IntelliJ IDEA. Arcode is able to learn correct ways of using frameworks' API to implement architectural concerns such as Authentication and Authorization from two sources, sample programs that practice the framework, and the byte code of that framework",
The Palladio component model for model-driven performance prediction,https://www-sciencedirect-com.proxy-ub.rug.nl/science/article/pii/S0164121208001015?via%3Dihub,2009,Journal of Systems and Software,No,No,Yes,No,,,,"Their approach uses the Palladio component model (PCM) to specify component-based software architectures in a parametric way. This model offers direct support of the CBSE development process by dividing the model creation among the developer roles. This paper presents their model and a simulation tool based on it, which is capable of making performance predictions",
Automated extraction of architecture-level performance models of distributed component-based systems,https://dl-acm-org.proxy-ub.rug.nl/doi/10.1109/ASE.2011.6100052,2011,ASE,No,No,Yes,No,,,,"In this paper, they present a novel automated method for the extraction of architecture-level performance models of distributed component-based systems, based on monitoring data collected at run-time",
Automated extraction of palladio component models from running enterprise Java applications,https://dl-acm-org.proxy-ub.rug.nl/doi/10.4108/ICST.VALUETOOLS2009.7981,2009,VALUETOOLS,No,No,Yes,No,,,,"In this paper, they present a method for automated extraction of performance models of Java EE applications, based on monitoring data collected during operation",
MoDisco: a generic and extensible framework for model driven reverse engineering,https://dl-acm-org.proxy-ub.rug.nl/doi/10.1145/1858996.1859032,2010,ASE,No,No,Yes,No,,,,"This paper introduces MoDisco, a generic and extensible open source reverse engineering solution",
Using regression splines for software performance analysis,https://dl-acm-org.proxy-ub.rug.nl/doi/10.1145/350391.350416,2000,WOSP,No,No,No,No,,,,"This research has addressed the estimation of accuracy of fit, and the control of the additional data gathering, to provide a controlled degree of error in the fitted function",
